Query ID,Question,Context,Answer,Sections,Pages
10,What was the first plane made by the wright brothers called,"charge high prices for productions and London city being a centre that distributed
raw materials, capital and products; helped Britain to surpass other countries in the
industrial production field.
1.2. Rise of the Industrial Revolution
The industrial revolution in Britain was based on three industries as given below.
 Textile industry
 Iron and steel industry
 Coal industry
The development that occurred in these fields resulted in the gradual progress in
other fields such as transport, communication and agriculture.
Textile Industry
Textile producers in Britain faced a challenge of increasing their textile products to meet
the high demand that came from their own colonies. Weaving clothes became a little faster
with the invention of the flying shuttle by John K. in 1733. But the slowness in preparing
threads needed in weaving clothes still remained a problem. According to the situation that
was there at that time, threads produced
by six thread makers per day were

In 1807, an American called Robert Fulton produced the steamboat. Henry Bell
produced the steam ship in 1811 for passenger transport. It used firewood as fuel at
the beginning and later coal. The production of motor car in 1885 by the German,
Daimler and the production of the aeroplane by Wright brothers in 1903, made
a huge change in the transport system. Thus, as a result of the expansion of the
industrial revolution, there was a rapid change in all forms of transport; land, water
and air transport.
Fig 1.10 Daimler’s motor car Fig 1.11 Aeroplane produced by
Wright brothers
 Expansion of Communication Sector
There was a rapid development in communication sector too in parallel to the
development in transport. The postal service that existed in Britain up to this was
very costly. A need arose to exchange letters quickly for a cheaper price in a shorter
time for business activities.
Fig 1.12 – Several experiments to develop communication between two distanced

threads needed in weaving clothes still remained a problem. According to the situation that
was there at that time, threads produced
by six thread makers per day were
enough only for one weaver to work for
one day. Therefore, there was some idea
of increasing the pace of spinning. As a
result of that enthusiasm, a person called
James Hargreaves produced a machine
called ‘Jenny’ in 1764 for cotton weaving.
This machine was a manually operated
one. Later in 1769, Richard Arkwright
produced a more efficient, water powered
spinning wheel. It was named as ‘water
Fig 1.1 – The Jenny machine produced by James turbine’. Arkwright’s creation was an
Hargreaves for spinning cotton in 1764
important production when compared
to the other machines used for the same
purpose in the past. But it was difficult to be used in houses because it was very big in size.
On the other hand, because a fast tide of water was needed to run the machine, it could be

roads. The production of the steam engine by George Stephenson in 1814 became a
landmark in the industrial revolution. As a result, trains could be used to transport
coal and other products. The time spent for transport could be minimized by
transporting products from factories to markets and transportation cost was
reduced by being able to transport heavy loads of goods at a time. It is believed that
George Stephenson who invented the locomotive engine was not able to read and
write till he was 17 years old.
Fig 1.9 The steam engine invented by George
Fig 1.8 George Stephenson Stephenson
The development that took place in land transport as a result of the industrial
revolution, affected the naval and water transport too.
- 8 -

Samuel Crompton who used the steel. Steel could be produced cheaply and
functioning principles of Spinning quickly in this method. Making an electric
Jenny and the Water Turbine oven to smelt ore by Wilhelm Siemens in
produced a new machine called 1870 helped the improvement of iron and
“Mule” around 1779. This helped steel industry. These mew creations paved
to produce finer and stronger the way for a rapid improvement in iron
threads. Then around 1785, Edmund and steel industry.
Cartwright found a way of running
the ‘Mule’ by steam power. Thus,
within a period of about 30 years
new machines and novel technical
methods were invented to make
spinning cotton more efficient.
Fig 1.2 –The water powered spinning machine Hence, there was a big revolution in
Fig 1.3 Henri Bessemer’s oven for producing steel
produced by Richard Arkwright the weaving industry during a short
period of time.
 ACTIVITY 2
 ACTIVITY 1
1. Prepare short questions from the section about iron and steel.

A new postal service which was called ‘Penny Postal Service’ was started for this in
1840. A letter could be sent to any corner of the country by spending just a penny
(pence) through this.
There arose another need for sending messages between two places more quickly
than sending letters with the rapid development of industrial and transport sector.
As a result of the experiments conducted for this, Samuel Morse was able to start
telegraph service in 1844. Sending messages between two places through a cable
was started in this method using symbols.
An immense change took place in the communication sector in 1895 when
Guglielmo Marconi invented the method of sending messages through radio signals
and then John Logie Baird invented the television. These two inventions supported
not only the development of communication but also the development of trade and
commerce including other economic activities.
Fig. 1.13 John Logie Baird and Fig 1.14 Marconi’s radio
the television he invented

removing dirt from iron in 1856. The invention of open oven method in 1860, by industries too. Therefore, James Watt developed this to a new steam engine in 1736.
developing the above mentioned method, enabled the production of high quality It was an efficient engine that could be used in many industries.
- 4 - - 5 -

that emerged as a result of the industrial revolution using firewood. Several new inventions were made in order to find solutions to the problems such
as removing the water that gathered in the mine when it was dug deep, poisonous
Hence, alternative methods had to be looked for. In 1730 the method of smelting gases found in the depth, increasing heat and providing light to the depth.
ore using coal was found by Abraham Darby. They produced molded iron in this
method. In 1784 tempered iron could be produced with the invention of 'Roller' Thomas Newcomen invented a steam engine in 1735 to pump water of the mines
machine by Henri Cort. Henri Bessemer found a new method to produce steel by and artificially cool the air. Yet, it was inefficient and could not be used in other
removing dirt from iron in 1856. The invention of open oven method in 1860, by industries too. Therefore, James Watt developed this to a new steam engine in 1736.

MMMaaacccaaadddaaammm MMMeeettthhhoooddd
MMMaaacccaaadddaaammm mmmeeettthhhoooddd mmmeeeaaannnsss sssppprrreeeaaadddiiinnnggg sssmmmaaallllll pppiiieeeccceeesss ooofff gggrrraaannniiittteee ooonnn aaa ssstttrrrooonnnggg fffooouuunnndddaaatttiiiooonnn
ooofff bbbiiiggggggeeerrr ssstttooonnneeesss aaannnddd sssoooiiilll aaannnddd mmmaaakkkiiinnnggg rrroooaaadddsss bbbyyy pppooouuunnndddiiinnnggg aaannnddd llleeevvveeelllllliiinnnggg ttthhheeemmm...
Even the vehicles that carry heavy loads of goods and passengers could be driven
fast and easily on these roads. Therefore, hundreds of miles of such roads were built
in Britain and Scotland within a short period.
Machines and engines used for transport too developed with the development of
roads. The production of the steam engine by George Stephenson in 1814 became a
landmark in the industrial revolution. As a result, trains could be used to transport
coal and other products. The time spent for transport could be minimized by

land, thousands of miles away from their motherland. France supported the
American forces during this war. Later Spain and Holland too joined the opposition
of Britain. As a result, the American freedom struggle became problematic for
Britain. Britain offered to have peace talks in 1783 because they had suffered losses
in several battles that took place in America. As a result America was accepted as
an independent country in the Paris Peace Pact signed in 1783. After that in 1789
Americans passed a new constitution. Thus George Washington became the first
president in America.
- 112 -","The Wright brothers' first airplane was called the Wright Flyer I, also sometimes referred to as the Kitty Hawk Flyer.","1.1 Beginning and Development of the Industrial Revolution, 7.1 Independence Struggle in America","13, 19, 18, 14, 20, 122"
11,"Don't based on given context above, using your general knowledge answer the question who the last president in Sri Lanka was.","who can obtain a 50% majority or a definite majority is declared the winner.
Mr. J. R. Jayewardene who was the Prime Minister in 1978 was nominated the
first executive president in Sri Lanka. Then a presidential election was held in
1982. Mr. J. R. Jayewardene was elected the president again in this election. The
second amendment to the 1978 constitution declared that the president could go
for an election requesting power for a second session once four years out of six
have already passed. After Mr. J. R. Jayewardene; Mr. Ranasinghe Premadasa, Mr.
- 92 -

universal franchise was given to Sri Lanka in 1937, until 1947, the political party the government in 1956 election by securing 51 seats. Mr. Bandaranayake was
system was not considered in elections. The political party system came into action the Prime Minister of Sri Lanka from 1956 to 1959. After the assassination of Mr.
in Sri Lanka in the election of 1947. By that election, political parties such as Lanka Bandaranayake, his wife Mrs. Sirimavo Bandaranayake became the leader of the
Sama Samaja Party, United National Party, Lanka Communist Party and Tamil party.
Congress were functioning.
- 82 - - 83 -

Lanka Communist Party 03 functioning of the government as, the governor general and the cabinet of ministers
Labour Party 01 headed by the prime minister, the parliament and the judiciary.
Independent Candidates 21
 The Governor General
Total 95
The post of governor which existed up to 1947 was discontinued and a governor
Mr. D.S. Senanayake who was able to win the support of many independent members
general was appointed to represent the British throne even under the new
was able to establish the government because the United National Party won the
constitution, the queen of Britain was accepted as the ruler of Sri Lanka and the
majority of the seats. Though the British government was willing to hand over the
governor general acted as the local representative of the queen. The post of the
responsibility of internal affairs to the Sri Lankans, they tried to keep foreign affairs governor general was completely a nominal executive post and had to take advice of

After the independence in 1948 politicians of this country had the responsibility
of handling the economy of the country that had been used for the benefit of the
British colonists for the betterment of the people. During the four decades after the
independence , the two major parties of Sri Lanka , the United National Party and
the Sri Lanka Freedom Party were in power and they tried to develop the economy
of Sri Lanka. They had tried several ways to develop the agriculture , industries and
the education of the country.
- 93 -

Fig. 4.3 D.B. Jayathilaka the first president in the congress. The prime objective
of establishing the Ceylon National Congress by this time was to organize a strong
struggle in demand of political power, combining all those small organizations
interested in politics. The unison of different ethnic groups such as Sinhalese,
Tamils and Muslims for a common target under the Ceylon National Congress was
an important incident in the history of Sri Lanka.
- 58 -

Acceptance of basic human rights in the constitution was a special characteristic.
 The President
Instead of the post of governor general of the Soulbury
Commission, the new constitution introduced the post
of nominal executive president. The prime minister
enjoyed the power of appointing the president. The
president had the same power enjoyed by the governor
general. The then Governor General, Mr. William
Gopallawa became the first nominal executive
president of Sri Lanka. Fig 6.2 Mr. William Gopallawa, the first
nominal executive president of Sri Lanka
 National State Council
The legislature named as the parliament before 1972 was named as the National
State Council in the new constitution. It consisted of members elected through the
universal franchise. This council functioned the people's legislative power. The
- 87 -

Write short notes on the following topics.
started to emerge because the Dutch started some minor industries and a payment
system for the work covered daily. These Europeans failed to make a significant
- State Council
change in the traditional socio – economic system because the major part of the
- Executive Councils
island was still under the power of the Kandyan kingdom during the time in which
- Universal Franchise
the coastal areas were governed by the Dutch and the Portuguese.
There existed a social system which was based on the traditional socio-economic
activities when Sri Lanka was captured by the British. There was an elite group in
that society but they were a small minority. The country was mostly governed by
the aristocrats. The greater majority of the country were the general public and they
lived on agriculture.
- 64 - - 65 -

Mr. S. W. R. D. Bandaranayake broke away from the United National Party and
established Sri Lanka Freedom Party in 1951. This party paid more attention on
the necessities of general public than the UNP and was able to win the support
of the vernacular scholars, monks and those who valued nationalism. The party
that won only 9 seats in the 1951 parliamentary election contested as the Mahajana
Eksath Peramuna by aligning with several other parties and was able to establish
the government in 1956 election by securing 51 seats. Mr. Bandaranayake was
the Prime Minister of Sri Lanka from 1956 to 1959. After the assassination of Mr.
Bandaranayake, his wife Mrs. Sirimavo Bandaranayake became the leader of the
party.
- 83 -

Lankans by changing the Donoughmore constitution, Marxists of the country too propose a new constitution for Sri Lanka which would meet the demands of the Sri
launched a struggle for independence. Communist leaders like Dr. N.M. Perera Lankans at the end of the war. As a result of that, the cabinet of ministers was
and Dr. Colvin R. De Silva who formed the Lanka Sama Samaja Party used the permitted to draft a new constitution suitable for Sri Lanka under certain
- 62 - - 63 -

island was still under the power of the Kandyan kingdom during the time in which
the coastal areas were governed by the Dutch and the Portuguese.
There existed a social system which was based on the traditional socio-economic
activities when Sri Lanka was captured by the British. There was an elite group in
that society but they were a small minority. The country was mostly governed by
the aristocrats. The greater majority of the country were the general public and they
lived on agriculture.
- 65 -","This answer is based on general knowledge beyond the provided context.  The last president of Sri Lanka was Gotabaya Rajapaksa, who resigned in 2022.","6.1 Soulbury Reforms and Independence, 6.2 Development after Independence, 4.2 The 1910 Reforms and their Background, C H A P T E R, 4.4 Protests for Independence","102, 92, 90, 103, 68, 97, 74, 93, 72, 75"
12,"""Through these reforms the number of unofficial members became a majority in the legislative council , thereby the power of the governer was reduced."" About which constitutional reforms is this statement about, only provide the reforms name ? ","sections because at the beginning, administrative power was not vested upon had presented petitions did not represent the general
the legislative council. At the same time, they were not happy of the fact that the public. But, the colonial office could not ignore the
number of unofficial members in the legislative council was the minority. They logical arguments put forward for constitutional
further opposed to the fact that they were appointed by the governor without using reforms. Even the colonial officers agreed to the fact
franchise for that. They started a limited struggle demanding the above changes. that a constitutional reform is necessary because 75
Their methods of struggle were; asking questions in the legislative council, making years had passed after the Colebrooke reforms were
proposals, publishing articles in newspapers, establishing organizations for struggle implemented. Thus, in November 1910, the secretary

 Manning Constitutional Reforms -1920
Sri Lankans were able to win these reforms in 1920 through their continuous
struggles because they were not satisfied with the Crew-McCallum constitution.
The number of the members of the Legislative Council was increased to 37 by this
reform. Among them 14 were official members and 23 were unofficial members.
Seven of the unofficial members were nominated by the governor. The other 16
were selected through limited franchise under the provincial representative system.
Though the number of the unofficial members was the majority, in critical situations
the 7 members nominated by the governor tend to join the 14 official members. This
created a majority to the side which is partial to the governor.
 Reforms
Legislature 37
Official 14 Unofficial 23
Nomination 07 Franchise 16
Some important characteristics of 1920 constitution:
• Unofficial members became the majority for the first time
• Introduction of the provincial representative system

 Reforms
Legislature 37
Official 14 Unofficial 23
Nomination 07 Franchise 16
Some important characteristics of 1920 constitution:
• Unofficial members became the majority for the first time
• Introduction of the provincial representative system
• Continuation of the ethnic representation
Even in these reforms the power of the governor was not reduced. The demand
of the Ceylon National Congress had been neglected. So, the Sri Lankan leaders
continued to protest. The Ceylon National Congress had an idea to refuse these
reforms at the beginning. As a result, the governor, William Manning promised
to introduce another reform within a short time. There was another constitutional
reform in 1924 following this. It was named as ‘Manning – Devonshire Reforms.’
- 59 -

[Chapter 1818: The aristocrats and the general public moved to such a struggle even before | 4.2 The 1910 Reforms and their Background] (Page 65)

logical arguments put forward for constitutional
reforms. Even the colonial officers agreed to the fact
that a constitutional reform is necessary because 75
years had passed after the Colebrooke reforms were
implemented. Thus, in November 1910, the secretary
of the colonies exclaimed that a constitutional reform
would be made. The new constitution designed by the
secretary of the colonies, Lord Crew according to the
Fig. 4.1 Mr. James Pieris recommendations of then governor; Henry McCallum
is called the “Crew – McCallum Constitution”.
- 55 -

[Chapter 1818: The aristocrats and the general public moved to such a struggle even before | 4.2 The 1910 Reforms and their Background] (Page 67)

[Chapter 1818: The aristocrats and the general public moved to such a struggle even before | 4.2 The 1910 Reforms and their Background] (Page 66)

The French monarchy consisted of an advisory board headed by the king and a
bench of ministers that functioned under the above mentioned advisory board. This
monarchy was highly corrupted. The local administration that was in the hands of
the aristocrats was extremely inefficient. Therefore, the government appointed a
group of officers called “intendant” for local administration. But, the battle between
the aristocrats and new officers made people suffer because the congruence of the
administration was broken.
People did not have a chance of complaining about their problems or protesting
against the monarchy however much they had to suffer.
There was a board consisting of people’s representatives which was called “States
General Council” where the problems of the general public were discussed. Yet,
it was not summoned for 175 years. Therefore the corrupted and inefficient
administration that existed in France monarchy led to a revolution in France.

• Discontinuation of the nationalist representative system
It was a group of European businessmen that first launched a struggle to get certain • Electing members from provinces according to the provincial representative
areas of the Colebrooke reforms amended. There were three unofficial members in system
the legislative council to represent the Europeans who were living in the country. • Increasing the power of the legislative committee
Those Europeans who were engaged in estate cultivation in the country wanted to
get roads, railways and other infrastructure that was necessary for estate cultivation The governor of Sri Lanka that time, Henry McCallum
developed. Yet, it was difficult to get financial allocations for the above mentioned opposed to these proposals. He argued that those who
sections because at the beginning, administrative power was not vested upon had presented petitions did not represent the general

considered the above mentioned fact as an obstacle to the freedom of the general
public proposed to reduce the power of the governor by estabilishing these councils.
There were 15 members in the legislative council appointed in 1833. Nine of them
were official members or those who were appointed in their position. The other 06
were unofficial members. Three of them were selected to represent Europeans and
one member each for the other three ethnicities; Sinhala, Tamil and Burger. The
governor exercised the power of appointing these 06 members.
Legislative Council
Official 09 Unofficial 06
Europeans Sinhalese Tamil Burger
03 01 01 01
- 52 -",Manning Constitutional Reforms of 1920.,"C H A P T E R, 4.2 The 1910 Reforms and their Background, 7.2 French Revolution","64, 69, 65, 67, 66, 126, 62"
