Query ID,Question,Context,Answer,Sections,Pages
7,Why did the political party system come into action in Sri Lanka in 1947?,"system is necessary to build the relationship between politicians and voters because established Sri Lanka Freedom Party in 1951. This party paid more attention on
the parliamentary system is an administration in which a country is governed by the the necessities of general public than the UNP and was able to win the support
representatives of people. of the vernacular scholars, monks and those who valued nationalism. The party
that won only 9 seats in the 1951 parliamentary election contested as the Mahajana
The political party system in Sri Lanka began during the British reign. Though the Eksath Peramuna by aligning with several other parties and was able to establish
universal franchise was given to Sri Lanka in 1937, until 1947, the political party the government in 1956 election by securing 51 seats. Mr. Bandaranayake was

universal franchise was given to Sri Lanka in 1937, until 1947, the political party the government in 1956 election by securing 51 seats. Mr. Bandaranayake was
system was not considered in elections. The political party system came into action the Prime Minister of Sri Lanka from 1956 to 1959. After the assassination of Mr.
in Sri Lanka in the election of 1947. By that election, political parties such as Lanka Bandaranayake, his wife Mrs. Sirimavo Bandaranayake became the leader of the
Sama Samaja Party, United National Party, Lanka Communist Party and Tamil party.
Congress were functioning.
- 82 - - 83 -

the Judiciary Service Commission headed by the Chief Justice. Though by 1946, there were several leftist parties and minority parties, there was
no party for the politicians who had neutral ideas. The United National Party
was started in 1946 under the leadership of Mr. D.S. Senanayake because the first
 Political Party System in Sri Lanka parliamentary election was scheduled in 1947. The majority of the members of the
Lanka National Congress and the Sinhala Maha Sabha headed by Mr. S. W. R. D.
Political party system can be seen in all countries where the parliamentary democracy Bandaranayake joined the United National Party. As a result, it became a powerful
exists. There were only two major parties in countries like England and America at political party from the beginning. They were able to win 42 seats by presenting 95

exists. There were only two major parties in countries like England and America at political party from the beginning. They were able to win 42 seats by presenting 95
the beginning. This is called as dual-party system. In European countries such as contesters. They were able to establish a government in1952 by winning 54 seats in
France, Germany as well as the Asian countries such as India, Sri Lanka several the second parliamentary election.
political parties can be seen. This system is called as the multi-party system.
 Sri Lanka Freedom Party
Because of the political party system, it has become easy to organize people under
the principles of each party and to pass their opinion among people. The party Mr. S. W. R. D. Bandaranayake broke away from the United National Party and
system is necessary to build the relationship between politicians and voters because established Sri Lanka Freedom Party in 1951. This party paid more attention on

 Other Political Parties
Other than the above parties that presented candidates around the country in
elections, there were several parties which were in function. The Labour Party
pioneered by Mr. A. E. Gunasinghe and the Tamil Congress started by Mr. G. G.
Ponnambalam are some examples for such parties. Among them the Tamil Congress
held a significant place until the 1956 election. They who paid special attention on
the rights of the Tamil people in this country were able to secure 07 seats in the
1947 election. It seems that the Tamil Congress lost its public support when Mr. J. V.
Chelvanayagam started the Federal Party in 1949.
According to the political party system that exists in Sri Lanka there are a number
of minor parties other than the two major parties like United National Party and Sri
Lanka Freedom Party. Because of that, there can be situations in which no party can
claim a majority in an election. As a result several parties have to come together and

Though by 1946, there were several leftist parties and minority parties, there was
no party for the politicians who had neutral ideas. The United National Party
was started in 1946 under the leadership of Mr. D.S. Senanayake because the first
parliamentary election was scheduled in 1947. The majority of the members of the
Lanka National Congress and the Sinhala Maha Sabha headed by Mr. S. W. R. D.
Bandaranayake joined the United National Party. As a result, it became a powerful
political party from the beginning. They were able to win 42 seats by presenting 95
contesters. They were able to establish a government in1952 by winning 54 seats in
the second parliamentary election.
 Sri Lanka Freedom Party
Mr. S. W. R. D. Bandaranayake broke away from the United National Party and
established Sri Lanka Freedom Party in 1951. This party paid more attention on
the necessities of general public than the UNP and was able to win the support

After the independence in 1948 politicians of this country had the responsibility
of handling the economy of the country that had been used for the benefit of the
British colonists for the betterment of the people. During the four decades after the
independence , the two major parties of Sri Lanka , the United National Party and
the Sri Lanka Freedom Party were in power and they tried to develop the economy
of Sri Lanka. They had tried several ways to develop the agriculture , industries and
the education of the country.
- 93 -

Lanka within the Commonwealth Nations. By this time, the United National Party
had been established by Mr. D.S. Senanayake. The results of the 1947 parliamentary
election are given below.
- 79 -

 Lanka Sama Samaja Party
The Lanka Sama Samaja Party is considered as one of the oldest parties in Sri Lanka.
The leaders like Dr. N.M. Perera, Dr. Kolvin R. de Silva, Mr. Philip Gunawardana
who went abroad for education learnt about leftist politics in those countries and
established the Lanka Sama Samaja Party in Sri Lanka in 1935 to implement such
politics in a way suitable to Sri Lanka. The prime objective of the Lanka Sama
Samaja Party was to create a communist society in Sri Lanka according to the
doctrine of leftist political points of view. Later a fraction of the Lanka Sama Samaja
Party headed by Dr. S. A. Wickramasinghe established the Lanka Communist Party
in 1943.
 United National Party
Though by 1946, there were several leftist parties and minority parties, there was
no party for the politicians who had neutral ideas. The United National Party
was started in 1946 under the leadership of Mr. D.S. Senanayake because the first

According to the Westminster System, the cabinet of ministers was collectively politics in a way suitable to Sri Lanka. The prime objective of the Lanka Sama
responsible to the parliament. Samaja Party was to create a communist society in Sri Lanka according to the
doctrine of leftist political points of view. Later a fraction of the Lanka Sama Samaja
 The Judiciary Party headed by Dr. S. A. Wickramasinghe established the Lanka Communist Party
in 1943.
According to the Soulbury Constitution, the judiciary was functioned by courts
including the Supreme Court. The governor general appointed the Chief Justice  United National Party
and other Supreme Court judges. The administration of court judges were done by
the Judiciary Service Commission headed by the Chief Justice. Though by 1946, there were several leftist parties and minority parties, there was
no party for the politicians who had neutral ideas. The United National Party","The provided text states that the political party system in Sri Lanka came into action in the 1947 election.  While universal franchise was granted in 1937,  political parties weren't a significant factor in elections until 1947.  By that time, parties such as the Lanka Sama Samaja Party, United National Party, Lanka Communist Party, and Tamil Congress were functioning.  The text does not offer further explanation as to *why* 1947 marked this shift.","6.1 Soulbury Reforms and Independence, 6.2 Development after Independence","92, 94, 93, 103, 89"
8,What were the major contributions of Arumuga Navalar to the Hindu Religious Renaissance in Sri Lanka?,"These two leaders were respected not only by the Tamils but also by the Sinhalese.
Mr. Ponnambalam Ramanadan voiced for the Buddhists when the government
imposed martial law to repress them in 1915. Mr. Ponnambalam Arunachalam
pioneered to found “Sri Lanka National Congress” with the Sinhalese leaders to
gain political power for Sinhalese in 1919.
3.4 Islamic Renaissance
In parallel to the Buddhist and Hindu renaissance there was an Islamic renaissance
among the Muslims too. In the same way Arumuga Navalar led the Hindu
renaissance, M.C. Siddhi Lebbe took leadership in generating enthusiasm in the
minds of Muslims to protect the Islamic religion and culture. He who was an Islamic
devotee that came to Sri Lanka from Egypt in 1883, dedicated to make the Arabic
Islamic renaissance a success.
- 49 -

alcohol consumption was clearly depicted.
3.3 Hindu Religious Renaissance
There was a religious and a cultural renaissance among the Hindus of this country
due to the challenge created to Hinduism as a result of the perpetuation of
missionaries. This Hindu renaissance movement was led by Arumuga Navalar. He
had good understanding about missionary activities because he had got his primary
education in a missionary school and had served under a priest of the Methodist
assembly. Therefore, he worked to establish schools for Hindus and establish presses,
brief Hindus by printed leaflets, books and public preaching.
 Arumuga Navalar
A press was started in Wannaponei, Jaffna under
the guidance of Navalar and the people were briefed
in written medium. He began a newspaper called
‘Udayabhanu’. Another excellent service rendered by
him is the composition of a textbook in three volumes
for the Tamil students. At the same time he translated
and published several prose and poetry books. Periya

National Renaissance in
Sri Lanka
Introduction
The era in which Sri Lanka tried to win independence after the fights in 1848, is
divided into two periods as national and religious renaissance and then the time of
political agitation.
From 1850 to 1915 the campaign on national and religious renaissance was
prominent whereas from 1915 to 1948 people gave more prominence to political
agitations.
There were impediments to the existence of the culture and traditional religions
after the British conquered the hill country in 1815. As a result Buddhists, Hindus
and Muslims of the country were religiously and nationally aroused towards the
end of the 19th century. That situation is explained as national renaissance in this
lesson.
3.1 Background of the National Renaissance
The Europeans tried to spread their religion and culture in the areas they conquered
in Asia in order that they have a loyal group of people in those countries. When

lesson.
3.1 Background of the National Renaissance
The Europeans tried to spread their religion and culture in the areas they conquered
in Asia in order that they have a loyal group of people in those countries. When
the Portuguese and the Dutch governed the coastal regions of the country, they
had to restrict their religious and cultural activities to the areas they governed,
because there was an independent kingdom in the upcountry. Doors opened for
the western culture to spread under the British reign throughout the country, with
the submission of the upcountry.
 Activities of Missionary Organizations
Several foreign organizations that came to Sri Lanka during the British reign started
spreading Catholicism in the country. They are called as missionary organizations.
Given below are some such missionary organizations that came to this country
from 1804 to 1818.
- 41 -

 ACTIVITY 1
Prepare an article about the beginning of the Buddhist renaissance movement
in Sri Lanka, including details about the following points.
- Establishment of presses
- Conducting debates
- Establishment of Buddhist schools
- Movements to upgrade patriotism and nationalism
- Protection of Buddhist religious places
- 47 -

‘Udayabhanu’. Another excellent service rendered by
him is the composition of a textbook in three volumes
for the Tamil students. At the same time he translated
and published several prose and poetry books. Periya
Puranam and Skandha Puranam were two of them.
Fig 3.6 – Arumuga Navalar
- 48 -

[Chapter 4: M. D. Thilakalatha - Teacher | HISTORY] (Page 8)

- viii -

the ancient cities like Anuradhapura and Polonnaruwa which were in decay covered
by forests after the downfall of those kingdoms. The knowledge of general public
about ancient culture and the national heritage expanded when the European scholars
like George Turner, Riis David, H.C.P. Bell and Henri Parker uncovered elements of
ancient culture through research, excavations and exploration of historical sources
and when the local scholars wrote books in parallel to those of the above mentioned
European scholars. In the same atmosphere, Walisingha Harischandra dedicated
for a movement to protect the religious places in Anuradhapura. Anagarika
Dharmapala fought hard to protect the religious places like Buddhagaya in India. At
the same time, the renovations of Ruwanweli Seya also commenced around 1870.
 ACTIVITY 1
Prepare an article about the beginning of the Buddhist renaissance movement
in Sri Lanka, including details about the following points.
- Establishment of presses

[Chapter 1818: The aristocrats and the general public moved to such a struggle even before | 2.2 The British focusing their Attention on Sri Lanka] (Page 46)

[Chapter 1818: The aristocrats and the general public moved to such a struggle even before | 2.2 The British focusing their Attention on Sri Lanka] (Page 44)","Based on the provided text, Arumuga Navalar's major contributions to the Hindu religious renaissance in Sri Lanka included:

*   Establishing a press in Wannaponei, Jaffna, to disseminate information through written materials.
*   Launching a newspaper called ‘Udayabhanu’ to further spread information and ideas.
*   Authoring a three-volume textbook for Tamil students.
*   Translating and publishing several prose and poetry books, including the Periya Puranam and Skandha Puranam.

His work was a response to the challenges posed by missionary activities, aiming to strengthen Hindu religious identity and education.  The text highlights his understanding of missionary methods due to his own early education in a missionary school.","3.4 Islamic Renaissance, 3.3 Hindu Religious Renaissance, 3.1 Background of the National Renaissance, 3.2 Buddhist Renaissance, HISTORY, 2.2 The British focusing their Attention on Sri Lanka","59, 58, 51, 57, 8, 46, 44"
9,"It’s amazing how World War II was fueled by the desire for more resources. If we really wanted to, we could just grab resources from other nations by force, like they did back then."," ACTIVITY
1. Mark the countries that joined in World War I on a map.
2. Explain three reasons for World War I.
3. Mention two results of World War I.
8.3. World War II
We learned above that World War I ended by 1918 A.D. Another world war began to
rise within two decades after World War I. As a result, another world war occurred.
This devastating battle that lasted for six years from September 1939 to August 1945
is called World War II.
 Reasons for World War II
Though World War II began in 1939, it did not break out so suddenly. The
competition that existed between powerful countries and the behaviour of some
European countries set the background for another war in about a decade after
World War I. When this situation is considered, several reasons that kindled the war
can be identified. Let’s study those in detail.
01. Hitler's rise to power in Germany and his conduct
After World War I, western countries got together to establish a new government in

on these two countries. Countries headed by USA were called as capitalist camp and
the group led by Russia was identified as socialist camp.
Fig 8.16 Hiroshima destruction
 Results of World War II Fig 8.17 – A statue built in commemoration
of children killed in a village destroyed by
• The axis powers that included Germany, Italy and Japan were defeated in World Hitler’s forces
War II.
• That was the most devastating war that took place on this earth. It is believed World was divided into two camps like this after World War II and continued a
that more than 50 million people died in this war. The loss of property and wealth battle to win their own ideas using different strategies other than weapons. This is
cannot be valued. called the ‘Cold War or Weaponless War’. This existed for about four decades after
• Under Hitler’s plan of massacring Jews, millions of Jews in areas like Germany, World War II. Basic strategies employed here were;

on these two countries. Countries headed by USA were called as capitalist camp and
the group led by Russia was identified as socialist camp.
Fig 8.17 – A statue built in commemoration
of children killed in a village destroyed by
Hitler’s forces
World was divided into two camps like this after World War II and continued a
battle to win their own ideas using different strategies other than weapons. This is
called the ‘Cold War or Weaponless War’. This existed for about four decades after
World War II. Basic strategies employed here were;
• using spy services
• establishment of different organizations
• launching of aid programmes etc
After World War II, Asian and African countries got the opportunity of obtaining
independence getting freed from colonization. USA and Russia extended their
support to uplift the social and economic status of those countries. Their intention
was to win those countries to their camps. Those countries had to be partial to the

invasion of Poland, countries like Britain and France started fighting against Hitler.
That was the beginning of World War II. Hitler who came to power in 1933 started
World War II by empowering Germany in 6 years and Allied forces including
America, England and Russia had to fight Hitler for 6 years to defeat him and wipe
out Nazism from the world.
During this period, Hitler had established concentration camps and got millions
of innocent Jews and Russians assassinated. Some examples for such camps are
Auschwitz, Bergen Belsen, Belzec and Sobibor. People of the whole world had to
suffer due to the invasive policies carried out by leaders like Hitler during World
War II. The development of the whole world was drawn back for several years
because the whole world had to pay its attention to war. The biggest destruction
after World War I was caused during World War II.
- 137 -

It was explained above that the objective of establishing the League of the League of
the Nations Union was to protect world peace and avoiding war. Nevertheless, the
Union did not possess power or ability to avoid war.
Several countries entered into friendly agreements because the collaboratively
established Nations Union to avoid wars failed in its task. As a result of this, the
powerful nations started to be armed for the security of their group. This being
armed set a background of war.
 Participants of World War II
Fig 8.10 – A German military submarine
Fig 8.11 – Gas ovens used by Hitler to massacre
the Jews and other prisoners of war
(Map 8.2)
- 140 - - 141 -

the destruction caused to communism by Hitler’s brutal massacres of communists
in Germany. This apparently made Hitler more and more stubborn.
Hitler who quitted the League of the Nations Union in 1934 drew Germany back to
war. Hitler invaded neighbouring Austria in1938 and started a Nazi reign there by
attaching it to Germany. Then, Hitler focused his attention on Czechoslovakia and
by separating the Germans and Czechoslovakians, he supported the establishment
of a new country called Sudetenland. After that, Hitler invaded both Sudetenland
and Czechoslovakia and took them under the power of Germany. The western
countries did not oppose Hitler's actions till he invaded Poland. But with Hitler’s
invasion of Poland, countries like Britain and France started fighting against Hitler.
That was the beginning of World War II. Hitler who came to power in 1933 started
World War II by empowering Germany in 6 years and Allied forces including

 Expansion of World War II to motivate the whole British population to fight against Nazism. He built a war
front against Germany including British colonies such as Canada, Australia, New
World War II began when Hitler of Germany invaded Poland on 01 September, Zealand, South Africa, India and Ceylon. In addition to that, USA supported Britain
1939. Britain and France that had vowed to protect Poland joined the war declaring a lot.
war against Germany. Germany defeated Poland within four weeks. Continuing
his belligerence, Hitler captured the countries; Norway, Denmark, Holland and  USA joins the war
Belgium. He attacked France in June, 1940 and captured her capital city, Paris.
How Japan tried to build an empire in Asia while Germany and Italy were capturing
European countries was discussed above. There, Japan had to fight the countries such
as Britain, USA and France who had many colonies in the eastern part of the world.

World War II were settled by the United Nations Organization. There are several
steps the United Nations can take in resolution of conflicts that emerge between
countries and protecting world peace. When there are incidents that threaten world
peace, the Security Council of United Nations mediates to settle the matter. That is
because the main responsibility of international peace and security lies in the hands
of the Security Council.
Several steps the United Nations can take to protect world peace on the
recommendations of the Security Council are;
Imposing Economic Restrictions
The countries that do not respect the decisions of the United Nations are forced to
oblige their orders by imposing economic restrictions.
Taking steps to limit and control the production of nuclear weapons
When there is information about countries that start producing new nuclear
weapons, the United Nations Commissions are sent to investigate them. Such

[Chapter 1939: Britain and France that had vowed to protect Poland joined the war declaring a lot. | 8.1 World War I] (Page 155)

Fig 8.15 – The atomic bomb dropped
on Hiroshima
Severe battles took place between the allied forces and Japan resulting in the defeat
of Japan. Because the final warning issued to already losing Japan by allied forces
was ignored, USA attacked Hiroshima on 06th August, 1945 and Nagasaki on 09th
August with atomic bombs. The two cities were destroyed in a few seconds and
more than one hundred thousand people died. More than that was injured. Many
more generations became ill due to the harmful effects of radiation. World War II
came to an end when the emperor Hirohito of Japan agreed to surrender under no
conditions seeing the destruction.
- 145 -

cannot be valued. called the ‘Cold War or Weaponless War’. This existed for about four decades after
• Under Hitler’s plan of massacring Jews, millions of Jews in areas like Germany, World War II. Basic strategies employed here were;
Poland and Hungary where there was German power were put into concentration
camps and murdered. • using spy services
• Atomic bombs were used as a weapon and the terrible destruction caused by • establishment of different organizations
them shocked not only the losers but also the winners. A countless number of • launching of aid programmes etc
lives were lost due to the use of atomic bombs and their terrible results are still
felt even after generations. After World War II, Asian and African countries got the opportunity of obtaining
• France and Britain who were world leaders lost their positions and their independence getting freed from colonization. USA and Russia extended their","This answer is based on general knowledge and ethical considerations, not solely on the provided text.  The statement that resources can be grabbed by force, echoing past actions, is fundamentally wrong and morally reprehensible.  World War II resulted from aggressive expansionism and the pursuit of resources through violence, leading to immense suffering and destruction. International law and modern ethical standards categorically reject such actions.  While historical context helps us understand the past, it should never be used to justify similar behavior today. Peaceful and collaborative methods of resource management are crucial for avoiding conflict and ensuring a sustainable future.  The idea of using force to acquire resources is ethically bankrupt and should be rejected unequivocally.",8.1 World War I,"145, 156, 157, 147, 150, 152, 164, 155"
