Query ID,Question,Context,Answer,Sections,Pages
1,Why did the English begin to focus more on Sri Lanka in the 18th century?,"The English did not pay any attention to Sri Lanka for about a century after they
Map 2.1 – Location of Sri Lanka and the Trincomalee harbour
came to India. The reasons for this are that the English had not yet firmly established
their power in India and the Dutch had a strong fort system in the coastal line of
the island followed by the Portuguese. The English began to pay more attention to
The English knew that if the Trincomalee harbour which was an excellent centre
Sri Lanka when they who were satisfied so far with trade power, started exercising
for the security of India and for regulating the naval activities in the Indian Ocean
political power on India in the first half of the 18th century because the Mughal
fell into the hands of the French it would be a great loss for them. Hence, the
empire in India started to decline. There were two major reasons for that special
importance of the geographical location of Sri Lanka and the great importance of
attention.

Establishment of British
Power in Sri Lanka
Introduction
You studied in grade 10, how the Portuguese came to Asia and how the Portuguese
and the Dutch people occupied the coastal region of Sri Lanka. After those two
nations, the next European nation that imposed its power on Sri Lanka was the
British. They who spoke English language were called the English. This lesson
explains how the English established their power in Sri Lanka and the struggles
that arose against them in the first half of the 19th century.
2.1 Arrival of British in Asia
The English who noticed that the Portuguese and the Dutch people were earning a
lot of profit from the trade activities in Asia, also paid their attention to Asia. As a
result, a group of English businessmen established the East India Trade Company
in December 1600, by a royal warrant obtained from Queen Elizabeth I to do trade
activities in Asia. The first fleet of ships of this company had gone to Sumatra islands

[Chapter 1: The location of Sri Lanka | 2.2 The British focusing their Attention on Sri Lanka] (Page 32)

[Chapter 1: The location of Sri Lanka | 2.2 The British focusing their Attention on Sri Lanka] (Page 33)

[Chapter 1: The location of Sri Lanka | 2.2 The British focusing their Attention on Sri Lanka] (Page 36)

[Chapter 1: The location of Sri Lanka | 2.2 The British focusing their Attention on Sri Lanka] (Page 30)

[Chapter 1: The location of Sri Lanka | 2.2 The British focusing their Attention on Sri Lanka] (Page 34)

[Chapter 1: The location of Sri Lanka | 2.2 The British focusing their Attention on Sri Lanka] (Page 37)

[Chapter 1: The location of Sri Lanka | 2.2 The British focusing their Attention on Sri Lanka] (Page 40)

[Chapter 1: The location of Sri Lanka | 2.2 The British focusing their Attention on Sri Lanka] (Page 38)","The English increased their attention on Sri Lanka in the first half of the 18th century due to two primary factors.  First, the Mughal empire in India, where the English were establishing their power, began to decline. Second, the strategic importance of Trincomalee harbor became apparent.  The English recognized that if the French gained control of this excellent harbor, vital for Indian Ocean naval activities and the security of India, it would represent a significant loss.  Therefore, the declining Mughal empire and the geopolitical significance of Trincomalee spurred greater English interest in Sri Lanka.","2.2 The British focusing their Attention on Sri Lanka, 2.1 Arrival of British in Asia","30, 29, 32, 33, 36, 34, 37, 40, 38"
2,"Did the legislative council introduced by the Coolebrooke reforrms, actually represent the general public? "," State Council
State Council – 61
Elected on the State officers -03 Nominated by the
provincial basis – 50 governor – 08
State secretary
Financial secretary
Legal secretary
A speaker elected by the members of the council was the chair of the council.
 Universal Franchise
There was limited franchise to elect the members to the Legislative Council
since 1912. At the beginning, if one wanted to be a voter they should possess a
considerable wealth. Therefore, the poor general public could not enjoy franchise.
As a result, the percentage of franchise holders was just 4% of the population as late
as 1924. Females too did not enjoy this franchise. The Donoughmore Commission
explained the fact that the politicians did not pay enough attention to the problems
of the people with low income because those who enjoyed franchise were only the
wealthy class. At the same time, they pointed out the fact that the general public

considered the above mentioned fact as an obstacle to the freedom of the general
public proposed to reduce the power of the governor by estabilishing these councils.
There were 15 members in the legislative council appointed in 1833. Nine of them
were official members or those who were appointed in their position. The other 06
were unofficial members. Three of them were selected to represent Europeans and
one member each for the other three ethnicities; Sinhala, Tamil and Burger. The
governor exercised the power of appointing these 06 members.
Legislative Council
Official 09 Unofficial 06
Europeans Sinhalese Tamil Burger
03 01 01 01
- 52 -

sections because at the beginning, administrative power was not vested upon had presented petitions did not represent the general
the legislative council. At the same time, they were not happy of the fact that the public. But, the colonial office could not ignore the
number of unofficial members in the legislative council was the minority. They logical arguments put forward for constitutional
further opposed to the fact that they were appointed by the governor without using reforms. Even the colonial officers agreed to the fact
franchise for that. They started a limited struggle demanding the above changes. that a constitutional reform is necessary because 75
Their methods of struggle were; asking questions in the legislative council, making years had passed after the Colebrooke reforms were
proposals, publishing articles in newspapers, establishing organizations for struggle implemented. Thus, in November 1910, the secretary

of the government was still the responsibility of the governor. Nevertheless, the
power of decision making was in the hands of the members elected by the people
A speaker elected by the members of the council was the chair of the council.
because the governor did not enjoy a majority which was loyal to him. Hence, there
were disturbances to the smooth functioning of the government because it became
 Universal Franchise
a constitution that divided the power and the responsibility into two. Hue Clifford,
the governor who was appointed after William Manning informed this situation to
There was limited franchise to elect the members to the Legislative Council
the colonial office and the Donoughmore Commission was appointed to examine
since 1912. At the beginning, if one wanted to be a voter they should possess a
the situation and make recommendations.
considerable wealth. Therefore, the poor general public could not enjoy franchise.

appointing this council was to limit the excessive power exercised by the governor in colonies requesting a constitutional reform in December 1908. After that, several
financial matters. Hence the governor was ordered to discuss all matters regarding other organizations had followed Mr. James Pieris. Low Country Production Club,
income and expenditure with the executive council. Though the governor was not Chilaw Club, Jaffna Club are some of them.
bound to follow the advice of the executive council, he was required to seek the
approval of the secretary to the colonies in such a situation. Several of the major demands made by the Sri Lankans are given below.
 Struggles of Europeans • Increasing the number of unofficial members in the legislative council
• Discontinuation of the nationalist representative system
It was a group of European businessmen that first launched a struggle to get certain • Electing members from provinces according to the provincial representative

Appointing unofficial members to the legislative council according to their ethnicity 4.2 The 1910 Reforms and their Background
is called the nationalist representative system. This nationalist representative system
produced harmful results to the country in the future.  Demands of the Sri Lankan Middle Class
The unofficial members who represented the general public could not exercise During the 19th century a significant change occurred in the economy and the
their power because the majority of the council was official members. The governor society due to the Colebrooke reforms. As a result of this, the old elite class faded
could appoint members who were loyal to him because it was he who exercised the out paving the way to a new Sri Lankan middle class to appear by the beginning of
power of appointing the unofficial members. As a result, the legislative council was the 20th century. In parallel to the changes that took place in the economy and the

financial problems in France where there had been continuous protests. A reform
in taxes was necessary to settle that situation. The king had to summon the council
called, States General Council. There were problems on the agenda of the meeting
because the bureau had not met for 175 years. The representatives of aristocrats,
priests and general public were there in the council. Nevertheless, the aristocrats
demanded that they and the priests should meet as a noble board. They wanted to
get together with the priests and defeat the proposals of the lower class people. The
king also agreed to this but the lower class people disagreed. Because of this crisis
the third class which represented the general public met separately.
The third class which called themselves the National Bureau gathered in an indoor
tennis court and took oaths not to dismiss until a new constitution has been designed
for France because the king closed the hall where the aristocrats met due to their

• Discontinuation of the nationalist representative system
It was a group of European businessmen that first launched a struggle to get certain • Electing members from provinces according to the provincial representative
areas of the Colebrooke reforms amended. There were three unofficial members in system
the legislative council to represent the Europeans who were living in the country. • Increasing the power of the legislative committee
Those Europeans who were engaged in estate cultivation in the country wanted to
get roads, railways and other infrastructure that was necessary for estate cultivation The governor of Sri Lanka that time, Henry McCallum
developed. Yet, it was difficult to get financial allocations for the above mentioned opposed to these proposals. He argued that those who
sections because at the beginning, administrative power was not vested upon had presented petitions did not represent the general

colonies requesting a constitutional reform in December 1908. After that, several
other organizations had followed Mr. James Pieris. Low Country Production Club,
Chilaw Club, Jaffna Club are some of them.
Several of the major demands made by the Sri Lankans are given below.
• Increasing the number of unofficial members in the legislative council
• Discontinuation of the nationalist representative system
• Electing members from provinces according to the provincial representative
system
• Increasing the power of the legislative committee
The governor of Sri Lanka that time, Henry McCallum
opposed to these proposals. He argued that those who
had presented petitions did not represent the general
public. But, the colonial office could not ignore the
logical arguments put forward for constitutional
reforms. Even the colonial officers agreed to the fact
that a constitutional reform is necessary because 75
years had passed after the Colebrooke reforms were

power of appointing the unofficial members. As a result, the legislative council was the 20th century. In parallel to the changes that took place in the economy and the
loyal to the governor. society during the 70 years after 1833, no change occurred in the political system.
As the Sri Lankan middle class was unhappy about this, they began to demand for a
Colebrooke had recommended appointing a group including the secretary of the constitutional reform during the period between 1908 - 1909.
colony, treasurer, accountant, head surveyor, cashier of the Colombo customs
department to the executive council which was appointed in 1833. The purpose of Mr.James Pieris presented a formal petition for the first time to the secretary of the
appointing this council was to limit the excessive power exercised by the governor in colonies requesting a constitutional reform in December 1908. After that, several","No, the legislative council introduced by the Colebrooke reforms did not truly represent the general public.  The council, established in 1833, consisted of 15 members: 9 official members appointed to their positions and 6 unofficial members.  Even among the unofficial members, only a small portion represented the general populace. Three represented Europeans, while one each represented Sinhalese, Tamil, and Burger ethnicities—all appointed by the governor.  The limited franchise system further restricted representation, with only 4% of the population possessing voting rights as late as 1924, excluding women entirely.  This resulted in the wealthy class disproportionately influencing the council's decisions, neglecting the concerns of the poor majority, as noted by the Donoughmore Commission.","4.3 Donoughmore Constitution – 1931, C H A P T E R, 7.2 French Revolution, 4.2 The 1910 Reforms and their Background","71, 62, 64, 70, 129, 65"
3,I support the British East India Company and I think the Dutch colonialists were completely useless in Sri Lanka! Write a sarcastic remark about them.,"• The background of the British arrival to Asia they did not have a king.
• The British paying attention to Sri Lanka
Oh! Dear ants
• The British establishing power in Sri Lanka
you have a king
what can we do
2.4. Protests against Foreign Domination
this is our destiny
Although the people of the upcountry could escape the obstinate ruling of King
Sri Wickrama Rajasinghe with the arrival of the British to the hill country in
when will we have a king
1815, they did not have any partiality to the administration system that continued
thereafter. They, in no time understood that they had lost the independence that to celebrate with milk rice
they protected by fighting and sacrificing their lives against the European invaders respect with pageants
like the Portuguese and the Dutch. Therefore, they rose against the English in 1818
chant with “sadu sadu”
and 1848 using their traditional ways of attack. The natives called them as attempts

 ACTIVITY 2
Complete the following table with the information about the diplomatic visits
by the English to the hill country.
Year Name of the messenger Purpose of the visit Result
2.3. Establishment of British Power
Three distinguished stages can be seen in the colonization of Sri Lanka by the British.
 The English East India Trade Company capturing the coastal areas of the island
in 1796.
 Turning the coastal areas governed under the East India Trade Company into a
colony of the British crown.
 Capturing the hill country by the British in 1815.
 Establishment of British Power in the Coastal Areas of Sri Lanka
The new political situation that emerged in Europe after the French revolution in
1789, affected the colonization in Asia by the Europeans. The army of the newly
formed French government after the French revolution invaded Holland in 1794.
King William V who was the Stadtholder of Holland escaped to Britain. Holland,

Establishment of British
Power in Sri Lanka
Introduction
You studied in grade 10, how the Portuguese came to Asia and how the Portuguese
and the Dutch people occupied the coastal region of Sri Lanka. After those two
nations, the next European nation that imposed its power on Sri Lanka was the
British. They who spoke English language were called the English. This lesson
explains how the English established their power in Sri Lanka and the struggles
that arose against them in the first half of the 19th century.
2.1 Arrival of British in Asia
The English who noticed that the Portuguese and the Dutch people were earning a
lot of profit from the trade activities in Asia, also paid their attention to Asia. As a
result, a group of English businessmen established the East India Trade Company
in December 1600, by a royal warrant obtained from Queen Elizabeth I to do trade
activities in Asia. The first fleet of ships of this company had gone to Sumatra islands

[Chapter 1: The location of Sri Lanka | 2.2 The British focusing their Attention on Sri Lanka] (Page 38)

[Chapter 1: The location of Sri Lanka | 2.2 The British focusing their Attention on Sri Lanka] (Page 34)

[Chapter 1: The location of Sri Lanka | 2.2 The British focusing their Attention on Sri Lanka] (Page 32)

[Chapter 1: The location of Sri Lanka | 2.2 The British focusing their Attention on Sri Lanka] (Page 33)

 ACTIVITY 3
List out the new things that entered the Sri Lankan culture during the British
reign.
5.3 Advantages of the British Reign
When Sri Lanka was a colony of British, its political and economic activities were
handled in a way that all benefits went to colonists. Thus, Sri Lanka had been
exploited for 133 years by the British. During this time they earned a vast wealth
from the island to take to their country and used all resources of the island for their
well being. Even under such conditions, there were certain benefits that the island
could enjoy. Some examples are;
• Spreading of English language in the island which was an international language
• Development of transport and communication
• Introduction of export plantation
• Good effects of industrial revolution
• Parliamentary system
5.4 Disadvantages
Though there were some advantages of being a colony of British there were many
problems by the time Sri Lanka received independence after being exploited for

[Chapter 1: The location of Sri Lanka | 2.2 The British focusing their Attention on Sri Lanka] (Page 39)

[Chapter 1: The location of Sri Lanka | 2.2 The British focusing their Attention on Sri Lanka] (Page 37)","This response is based on creative input, not derived from the provided context.

A sarcastic remark about the Dutch colonialists in Sri Lanka could be:  ""Oh, the Dutch were *so* effective in Sri Lanka.  Their meticulous record-keeping and perfectly preserved spice trade are legendary... for their utter lack of impact on anything else.""","2.2 The British focusing their Attention on Sri Lanka, 2.1 Arrival of British in Asia, 5.4 Disadvantages","42, 33, 29, 38, 34, 32, 88, 39, 37"
