text,pages,sections
"While there was a growing displeasure about the British administration among the upcountry people, a person called Doresami emerged from Wellassa who claimed The Badulla agent Douglas Wilson, came to know that he was gathering forces to regain the kingdom with the help of the local elite like",[44],['is the loss of income the aristocrats suffered because the English cancelled the']
"Hence, Douglas Wilson sent a platoon with Hajji Muhandiram to arrest Doresami. Yet, he was killed by the rebels. Wilson too was killed by an archer when he set out to arrest Doresami.","[44, 45]",['is the loss of income the aristocrats suffered because the English cancelled the']
"government noticed that the people of Wellassa were gathering around Doresami, they sent Kappetipola who was in charge of Uva to control the situation. Keppetipola returned the English troops that came with him and joined the rebels. This resulted in the fights spreading to many parts of the upcountry.",[45],['is the loss of income the aristocrats suffered because the English cancelled the']
"aristocrats, only Molligoda and Eknaligoda Disawe did not join the fights. Doresami was declared the upcountry king by the rebels under the guidance of Kappetipola Disawe was appointed the Mahaadikaram of the new king. Another problem the British faced was the Tooth Relic which was believed to be the",[45],['is the loss of income the aristocrats suffered because the English cancelled the']
symbol of the kingship falling into the hands of rebels. by the British because of the close kinship he had with the other aristocrats who were leading the struggle though he did not join the fights. arrested and brought to Colombo by the British.,[45],['is the loss of income the aristocrats suffered because the English cancelled the']
The British were too vicious in imposed martial law to the upcountry that were there in the coastal regions were summoned to the upcountry.,[45],"['The British were too vicious in', 'imposed martial law to the upcountry', 'that were there in the coastal regions']"
followed a land sweeping policy to wipe arresting as many men as possible and prosecuting under martial law were people could not persist with the battle,[45],"['arresting as many men as possible and', 'followed a land sweeping policy to wipe', 'people could not persist with the battle', 'prosecuting under martial law were']"
"in the face of the harsh retaliation of arrest several leaders of the battle. of those arrested were Maththamagoda, Kobbekaduwa, Dambawinna Disawe",[45],['in the face of the harsh retaliation of']
"and Galagedara Mohottala, Basnayaka Nilame of Katharagama, Butawe Rate The English spread news saying that the one who said to be the king in the battle",[45],"['The English spread news saying that the', 'in the face of the harsh retaliation of', 'one who said to be the king in the battle']"
"was not the real Doresami and he was not the real heir to the throne. disputes among the main leaders of the struggle such as Kappetipola, Madugalle By August and September of 1818, the battle had died down a  Struggle for Independence in 1848 The English were able to arrest Kappetipola and Madugalle in October.","[45, 46]","['lot. The English were able to arrest Kappetipola and Madugalle in October. They', 'one who said to be the king in the battle']"
"were sentenced to death by the court martial. They were executed by the British on In about 30 years following the failure of the 1818 struggle, there was another battle the 26th of November, 1818. against the British government. This struggle which tried for the second time to",[46],['lot. The English were able to arrest Kappetipola and Madugalle in October. They']
"reestablish the imperial system the upcountry people used to have, can be named as  Failure of the 1818 Battle and Its Effects the second armed battle for the independence. There were several reasons that led to the emergence of such a battle which began in 1848.",[46],['lot. The English were able to arrest Kappetipola and Madugalle in October. They']
"The rebellion spread fast within a few months after the beginning. forces chased away the rebels from one area by destroying property, the battle  Causes of the Battle Yet, the upcountry people failed to launch a combined There were two major factors that led to the 1848 struggle as the effects of the",[46],['lot. The English were able to arrest Kappetipola and Madugalle in October. They']
"attack when the English started a heavy retaliation with extra forces. Colebrooke reforms and the new tax policy of the government. advantage when it became possible for them to keep contact with Colombo via Sathara Korala because the in-charge of that area, Molligoda Nilame was partial to",[46],"['Colebrooke reforms and the new tax policy of the government.', 'lot. The English were able to arrest Kappetipola and Madugalle in October. They']"
" Effects of the Colebrooke Reforms Thus, there were several reasons for the loss of the battle. Land Policy of the Government  Reasons for the failure of the 1818 Battle:",[46],"['Colebrooke reforms and the new tax policy of the government.', 'can be summarized as follows.']"
"The government launched a policy of selling lands under the Colebrooke reforms  The heavy retaliation launched by the British which were started in 1833. The government land policy was problematic for the  Shortage experienced by the upcountry people, of weapons and other resources general public of the area because the land in the upcountry was rich and the",[46],['can be summarized as follows.']
"environment was conducive for coffee cultivation. that are needed for a long battle Act imposed in 1840, uncultivated lands that could not be proven of their continual  Disorganized nature of the battle",[46],"['can be summarized as follows.', 'that are needed for a long battle']"
"ownership for 30 years were confiscated. There were no legal documents to prove the  The exposure of the real identity of the person who claimed to be the heir to ownership of lands of the upcountry people that came to them from their descent. As a result, many of their Chena lands were taken back to the government.",[46],['that are needed for a long battle']
"government sold these lands for very cheaper prices to the foreigners. As a result of the battle for freedom, leaders like Ehelepola, Kappitipola, Madugalle people lost their lands and the cultivation was disturbed thus, they were distressed had to sacrifice their lives for the independence of the country.",[46],['that are needed for a long battle']
more aristocrats were confiscated. Some leaders who supported the battle were Those who went against the government were punished Discontinuation of “Gam Sabha”,[46],['that are needed for a long battle']
"thus whereas the other aristocrats like Molligoda, Eknaligoda who were partial to The existence of ‘Gam Sabha’ was challenged because the compulsory service system and the duty labour system were banned by the Colebrooke Commission. The British were able to strengthen their grip of the upcountry region because",[46],['that are needed for a long battle']
"The building and maintenance of lakes, bunds, canals and dams of each area were The governor, Brownrigg issued a special announcement strengthening his power in the upcountry on the 21st of November, 1818. This long done by the Gam Sabha (village council).",[46],['that are needed for a long battle']
"The major method the Gam Sabha got labour was the system called ""duty labour"". Yet, when this method was cancelled, document which consisted of 56 statements curtailed the power of the aristocrats.",[46],"['labour was the system called ""duty labour"". Yet, when this method was cancelled,', 'that are needed for a long battle']"
the Gam Sabha found it difficult to get necessary labour forces. Steps were taken to establish the English legal system in the upcountry reducing the did a good service by solving the minor problems in the area. legal power enjoyed by the aristocrats.,[46],"['labour was the system called ""duty labour"". Yet, when this method was cancelled,', 'legal power enjoyed by the aristocrats. It seems that the 1818 November document']"
It seems that the 1818 November document judiciary power due to the reforms in 1833. The villagers had to suffer due to such made the British power in the upcountry complete.,[46],['legal power enjoyed by the aristocrats. It seems that the 1818 November document']
" Struggle for Independence in 1848 In about 30 years following the failure of the 1818 struggle, there was another battle against the British government. This struggle which tried for the second time to",[47],"['In about 30 years following the failure of the 1818 struggle, there was another battle', 'legal power enjoyed by the aristocrats. It seems that the 1818 November document']"
"reestablish the imperial system the upcountry people used to have, can be named as the second armed battle for the independence. There were several reasons that led to the emergence of such a battle which began in 1848.",[47],"['In about 30 years following the failure of the 1818 struggle, there was another battle']"
There were two major factors that led to the 1848 struggle as the effects of the Colebrooke reforms and the new tax policy of the government.  Effects of the Colebrooke Reforms Land Policy of the Government,[47],"['Colebrooke reforms and the new tax policy of the government.', 'In about 30 years following the failure of the 1818 struggle, there was another battle']"
The government launched a policy of selling lands under the Colebrooke reforms The government land policy was problematic for the general public of the area because the land in the upcountry was rich and the environment was conducive for coffee cultivation.,[47],['Colebrooke reforms and the new tax policy of the government.']
"Act imposed in 1840, uncultivated lands that could not be proven of their continual ownership for 30 years were confiscated. There were no legal documents to prove the ownership of lands of the upcountry people that came to them from their descent.",[47],['Colebrooke reforms and the new tax policy of the government.']
"As a result, many of their Chena lands were taken back to the government. government sold these lands for very cheaper prices to the foreigners. people lost their lands and the cultivation was disturbed thus, they were distressed Discontinuation of “Gam Sabha”",[47],['Colebrooke reforms and the new tax policy of the government.']
"The existence of ‘Gam Sabha’ was challenged because the compulsory service system and the duty labour system were banned by the Colebrooke Commission. The building and maintenance of lakes, bunds, canals and dams of each area were done by the Gam Sabha (village council).",[47],['Colebrooke reforms and the new tax policy of the government.']
"The major method the Gam Sabha got labour was the system called ""duty labour"". Yet, when this method was cancelled, the Gam Sabha found it difficult to get necessary labour forces.",[47],"['Colebrooke reforms and the new tax policy of the government.', 'labour was the system called ""duty labour"". Yet, when this method was cancelled,']"
did a good service by solving the minor problems in the area. judiciary power due to the reforms in 1833. The villagers had to suffer due to such New Judiciary System an unwise decision and there was an elevated resistance against this tax also.,"[47, 48]","['labour was the system called ""duty labour"". Yet, when this method was cancelled,']"
"government conducted a survey for the collection of statistics called the ‘Blue Book’ Villagers had to go to courts even for a small matter according to Cameron’s legal at the same time when new taxes were imposed. The people suspected this move too Earlier, they could get such matters resolved in their villages.",[48],"['Villagers had to go to courts even for a small matter according to Cameron’s legal at the same time when new taxes were imposed. The people suspected this move too', 'labour was the system called ""duty labour"". Yet, when this method was cancelled,']"
"They were as a way of imposing more taxes. not aware either of the English language or the rules and regulations that were in Some other problems the villagers had to face were that  Nature of the 1848 Struggle they had to pay all lawyers’ charges, stamp fees in cash and had to spend days in the",[48],['Villagers had to go to courts even for a small matter according to Cameron’s legal at the same time when new taxes were imposed. The people suspected this move too']
"court when they went for legal matters. As a result, their agricultural work including Fights began between the government and the people when people gathered to the protection of their cultivations was neglected. oppose the tax policy of the government.",[48],"['court when they went for legal matters. As a result, their agricultural work including Fights began between the government and the people when people gathered to']"
"People gathered in major cities such as Colombo, Galle, Kandy and Badulla and they protested against the English civil Distancing Relationship between the People and the Government servants in these rallies. Some farmers that gathered in Badulla smashed their guns",[48],"['Colombo, Galle, Kandy and Badulla and they protested against the English civil', 'court when they went for legal matters. As a result, their agricultural work including Fights began between the government and the people when people gathered to']"
on the ground in front of the government agents to show their displeasure. The decisions to reduce the number of civil service posts and allowing the civil 40 people gathered in front of the Kandy Kachcheri and protested against these servants to engage themselves in estate cultivation following the Colebrooke taxes. Armed forces had to be summoned because the police could not control those,[48],"['Colombo, Galle, Kandy and Badulla and they protested against the English civil']"
"recommendations, made the local administration inefficient. The protests that began in Colombo and Kandy spread to areas like Matale, of the administration officer expanded and they found it difficult to supervise such Dambulla, Wariyapola and Kurunegala. Because some officers were more attentive on cultivation, they did not",[48],"['Colombo, Galle, Kandy and Badulla and they protested against the English civil']"
"have enough time to attend to the needs of the people. As a result, the problems of People in areas like Matale, Wariyapola and Kurunegala organized themselves with the general public were not properly informed to the government and it affected to arms and attacked the government buildings like courts. widen the relationship between the people and the government.",[48],"['Colombo, Galle, Kandy and Badulla and they protested against the English civil']"
"high pressure due to the tax policy of the government, leaders like Gongalegoda Banda, Puran Appu, Dingirala and Diyes emerged from people and led the battle. The New Tax Policy of the Government A group of rebels gathered in the Dambulla temple and coronated Gongalegoda Banda as the king with the help of the chief incumbent.",[48],"['Colombo, Galle, Kandy and Badulla and they protested against the English civil']"
"The closest reason for the struggle was the decision of the governor, Sir Torrington Because the government income had gone down, the Matale was the centre of the battle in 1848. In addition to this, fights spread to some governor made a tax reform with the purpose of earning a considerable sum from parts of the Kandy and Kurunegala districts.",[48],"['Colombo, Galle, Kandy and Badulla and they protested against the English civil']"
"But, the English using their experience A stamp fee, cart and catamaran tax, tax on shops, tax on guns, body tax, of the 1818 battle overpowered the insurgency soon. and tax on dogs were those new taxes. People opposed all those taxes; especially the due to the suppression launched by the governor, Torrington employing the armed",[48],"['Colombo, Galle, Kandy and Badulla and they protested against the English civil']"
"protest against the taxes on guns, body and dogs was significant. As a result, the British were able to arrest many of the leaders within two Gongalegoda Banda, who was arrested so, was trialed, whipped The villagers used guns to protect their cultivations.",[48],"['Colombo, Galle, Kandy and Badulla and they protested against the English civil']"
They had to pay two shillings and exiled from the country. Puran Appu was sentenced to death and he faced death and a half every year for the tax on guns. The villagers had to go to government bravely.,[48],"['Colombo, Galle, Kandy and Badulla and they protested against the English civil']"
"Some other fighters were imprisoned. At the same time, there was a strong offices for this and to fill in the forms in English language. They had to pay indignation against the government because the arrested Rev.",[48],"['Colombo, Galle, Kandy and Badulla and they protested against the English civil']"
extra charges in addition to the time spent. Charges they had to pay for the guns was shot and killed after a very short trial without taking proper legal actions. sometimes exceeded the real value of the guns. There was a resistance for the tax on,[48],"['Colombo, Galle, Kandy and Badulla and they protested against the English civil']"
guns because of the above reasons. Every grown up male had to work in building roads for six days every year and The major reason for the failure of the struggle was its disorganized nature similar to if they failed to do so they had to pay three shillings as a tax on their body.,[48],"['Colombo, Galle, Kandy and Badulla and they protested against the English civil', 'if they failed to do so they had to pay three shillings as a tax on their body. There']"
The majority of the rebels were from the general public who did not was opposition for this tax also. People had to pay taxes for dogs in 1848. have any armed training or proper weapons.,[48],['if they failed to do so they had to pay three shillings as a tax on their body. There']
The British had good knowledge about an unwise decision and there was an elevated resistance against this tax also. government conducted a survey for the collection of statistics called the ‘Blue Book’ at the same time when new taxes were imposed.,"[48, 49]",['if they failed to do so they had to pay three shillings as a tax on their body. There']
The people suspected this move too as a way of imposing more taxes. Fights began between the government and the people when people gathered to oppose the tax policy of the government.,[49],['if they failed to do so they had to pay three shillings as a tax on their body. There']
"People gathered in major cities such as Colombo, Galle, Kandy and Badulla and they protested against the English civil Some farmers that gathered in Badulla smashed their guns on the ground in front of the government agents to show their displeasure.",[49],"['Colombo, Galle, Kandy and Badulla and they protested against the English civil', 'if they failed to do so they had to pay three shillings as a tax on their body. There']"
"40 people gathered in front of the Kandy Kachcheri and protested against these Armed forces had to be summoned because the police could not control those The protests that began in Colombo and Kandy spread to areas like Matale, Dambulla, Wariyapola and Kurunegala.",[49],"['4000 people gathered in front of the Kandy Kachcheri and protested against these', 'crowds. The protests that began in Colombo and Kandy spread to areas like Matale,']"
"People in areas like Matale, Wariyapola and Kurunegala organized themselves with arms and attacked the government buildings like courts. high pressure due to the tax policy of the government, leaders like Gongalegoda Banda, Puran Appu, Dingirala and Diyes emerged from people and led the battle.",[49],"['crowds. The protests that began in Colombo and Kandy spread to areas like Matale,']"
"A group of rebels gathered in the Dambulla temple and coronated Gongalegoda Banda as the king with the help of the chief incumbent. Matale was the centre of the battle in 1848. In addition to this, fights spread to some",[49],"['crowds. The protests that began in Colombo and Kandy spread to areas like Matale,']"
"parts of the Kandy and Kurunegala districts. But, the English using their experience of the 1818 battle overpowered the insurgency soon. due to the suppression launched by the governor, Torrington employing the armed",[49],"['crowds. The protests that began in Colombo and Kandy spread to areas like Matale,']"
"As a result, the British were able to arrest many of the leaders within two Gongalegoda Banda, who was arrested so, was trialed, whipped Puran Appu was sentenced to death and he faced death Some other fighters were imprisoned.",[49],"['crowds. The protests that began in Colombo and Kandy spread to areas like Matale,']"
"At the same time, there was a strong indignation against the government because the arrested Rev. was shot and killed after a very short trial without taking proper legal actions. The major reason for the failure of the struggle was its disorganized nature similar to",[49],"['crowds. The protests that began in Colombo and Kandy spread to areas like Matale,', 'indignation against the government because the arrested Rev. Kadahapola Thero']"
The majority of the rebels were from the general public who did not have any armed training or proper weapons. The British had good knowledge about the roads in the hill country by that time and the rebels could not fight against the 3,"[49, 50]","['C H A P T E R', 'indignation against the government because the arrested Rev. Kadahapola Thero']"
"military power, strategies and the weapons of the British. the battle easily because it was limited to several areas of the upcountry. The English government appointed a special committee to probe into the situation of this country because the governor, Torrington’s conduct in 1848 battle was highly",[50],"['C H A P T E R', 'National Renaissance in', 'Sri Lanka']"
"As a result he was summoned back to England. public displeasure were given up. Accordingly, the trade shop tax and dog tax were The rest of the taxes were revised and reformed.",[50],['criticized. As a result he was summoned back to England. Taxes that generated']
"on Buddhism because there was displeasure among the people about the way the A special attention was paid to solving the problems of farmers though no proper steps were taken for that before 1850. The era in which Sri Lanka tried to win independence after the fights in 1848, is",[50],"['Introduction', 'criticized. As a result he was summoned back to England. Taxes that generated']"
divided into two periods as national and religious renaissance and then the time of From 1850 to 1915 the campaign on national and religious renaissance was  ACTIVITY 5 prominent whereas from 1915 to 1948 people gave more prominence to political Complete the following table using information about the rebellions of 1818 There were impediments to the existence of the culture and traditional religions,[50],"['Complete the following table using information about the rebellions of 1818 There were impediments to the existence of the culture and traditional religions', 'Introduction']"
and 1848. after the British conquered the hill country in 1815. and Muslims of the country were religiously and nationally aroused towards the Year Reasons for the battle Leaders of the battle Results of the end of the 19th century. That situation is explained as national renaissance in this,[50],['Complete the following table using information about the rebellions of 1818 There were impediments to the existence of the culture and traditional religions']
"3.1 Background of the National Renaissance The Europeans tried to spread their religion and culture in the areas they conquered in Asia in order that they have a loyal group of people in those countries. the Portuguese and the Dutch governed the coastal regions of the country, they",[50],"['3.1 Background of the National Renaissance', 'in Asia in order that they have a loyal group of people in those countries. When']"
"had to restrict their religious and cultural activities to the areas they governed, because there was an independent kingdom in the upcountry. the western culture to spread under the British reign throughout the country, with the submission of the upcountry.",[50],['in Asia in order that they have a loyal group of people in those countries. When']
 Activities of Missionary Organizations Several foreign organizations that came to Sri Lanka during the British reign started spreading Catholicism in the country. They are called as missionary organizations.,[50],['in Asia in order that they have a loyal group of people in those countries. When']
"Given below are some such missionary organizations that came to this country The era in which Sri Lanka tried to win independence after the fights in 1848, is divided into two periods as national and religious renaissance and then the time of From 1850 to 1915 the campaign on national and religious renaissance was","[50, 51]","['Introduction', 'in Asia in order that they have a loyal group of people in those countries. When']"
prominent whereas from 1915 to 1948 people gave more prominence to political There were impediments to the existence of the culture and traditional religions after the British conquered the hill country in 1815. and Muslims of the country were religiously and nationally aroused towards the,[51],['Introduction']
