text,pages,sections
The Gamsabha could get the necessary labour for the above mentioned duties under the traditional duty service system. the Kandyan Kingdom ‘Gamsabha’ had become a minor court in the village. The labour needed for the government was received through the duty service system,[76],['lived on agriculture.']
"by the administration under the ruling system before 1815.There were two ways of providing service as compulsory service system and duty, based on land occupancy. In the past, those who supplied compulsory service to the king were awarded land Those who cultivated these lands which were called as service",[76],"['In the past, those who supplied compulsory service to the king were awarded land', 'lived on agriculture.']"
patrimony lands provided necessary services to the king. these lands gave them to the general public for cultivation and they had to repay it by providing services through labour. It was called as duty of occupancy.,[76],"['In the past, those who supplied compulsory service to the king were awarded land']"
"All adult males of the country had to serve the king for no salary for a decided This was conducted under the heads of the village and Often, the labour necessary for the common activities of the village was taken from this compulsory service system.",[76],"['In the past, those who supplied compulsory service to the king were awarded land']"
 Economic Reforms in Colebrooke Commission The major reason for sending the Colebrooke Commission to Sri Lanka was the expenditure of the government exceeded the income of the government. tried to introduce several economic reforms to Sri Lanka because he wanted to,[76],"['In the past, those who supplied compulsory service to the king were awarded land']"
establish an economic system that met the objectives of the English. wanted to invest money on profitable business in order to avoid financial difficulties The objective of the Colebrooke Commission was to build a situation in which the private entrepreneurs could invest money because the,"[76, 77]","['In the past, those who supplied compulsory service to the king were awarded land']"
"government could not afford it. Colebrooke recommended that the government should move into a policy of selling lands because the existing traditional land tenure system was an obstacle for the Thus, both the locals and foreigners had the opportunity",[77],"['Colebrooke recommended that the government should move into a policy of selling', 'In the past, those who supplied compulsory service to the king were awarded land', 'lands because the existing traditional land tenure system was an obstacle for the']"
to buy land as much as they wanted. The civil servants too got the opportunity of buying government lands because Colebrooke recommended that all civil servants are permitted to engage themselves in estate cultivation.,[77],['lands because the existing traditional land tenure system was an obstacle for the']
"The investors who bought lands wanted labour to cultivate those lands. to the traditional compulsory service system, people were forced to work for the Colebrooke noticed that they were not suitable for the private entrepreneurship and it was an obstacle for the freedom of the people.",[77],['lands because the existing traditional land tenure system was an obstacle for the']
"Therefore, he thought of abolishing the compulsory service. became something that could be bought and that was the beginning of a labour class that worked for wages in Sri Lanka. When Colebrooke came to Sri Lanka, cinnamon and salt trade was a government",[77],"['class that worked for wages in Sri Lanka.', 'lands because the existing traditional land tenure system was an obstacle for the']"
"Continuing a government monopoly does not match with the private Therefore it was suggested to break the monopoly on cinnamon and salt trade and allow the private sector too join that trade. the government income those days were the levies on fish, land and alcohol and",[77],['class that worked for wages in Sri Lanka.']
"For an example, a portion of the fish caught had to be The right to earn taxes was auctioned and the fishermen had to pay the tax in fish to those who had bought the tax right. proposed to transfer into an indirect tax by issuing permits for boats.",[77],['class that worked for wages in Sri Lanka.']
The authority of tax collection was auctioned and those who bought it collected taxes from the products of lands. recommended to collect an equal amount in cash from all lands. Colebrooke further recommended the establishment of a savings bank in the island.,[77],"['Colebrooke further recommended the establishment of a savings bank in the island.', 'class that worked for wages in Sri Lanka.']"
The purpose of establishing a bank was to allow the entrepreneurs who invest money on estate cultivation obtain money to a reasonable interest. There was a broad change in the economy of Sri Lanka after Colebrooke recommendations came into effect in 1833.,"[77, 78]",['Colebrooke further recommended the establishment of a savings bank in the island.']
Foreign investors could buy thousands of acres of land in Sri Lanka because there were no rich people among locals who could invest in mega scales though Colebrooke wanted to encourage private This was not a secret to Colebrooke too.,[78],['Colebrooke further recommended the establishment of a savings bank in the island.']
"Foreigners invested money on trade based agriculture which was profitable in the As a result, there was rapid expansion in plantation sector in the Though coffee plantation began during the Dutch period in small scale in coastal areas, because a prominent place was given to cinnamon plantation, coffee plantation",[78],"['19th century.', 'Colebrooke further recommended the establishment of a savings bank in the island.']"
"When the English came to Kandy, coffee plantation had been done in several places as a home cultivation. It developed into a plantation during the Several factors were there that affected the development of the",[78],"['19th century.', 'in several places as a home cultivation. It developed into a plantation during the']"
coffee plantation in the 19th century. Factors that helped the development of the coffee plantation: • More investment on coffee plantation by foreigners after the Colebrooke • Increasing demand for coffee in the European market.,[78],['coffee plantation in the 19th century.']
• High profit drawn through coffee plantation. • Ability to get cheap labour from the Indian labourers in the plantation sector. Some other reasons for the expansion of coffee cultivation were the reduction of export tax for coffee and releasing of the labourers who worked in coffee plantation,[79],['coffee plantation in the 19th century.']
from compulsory service system during the time of the governor Edward Barnes Coffee plantation was expanding fast in the upcountry region during the period Even the government officers started growing coffee because it was Reports say that there were about 500 acres of coffee plantation in,[79],"['Coffee plantation was expanding fast in the upcountry region during the period', 'coffee plantation in the 19th century.', 'very profitable. Reports say that there were about 500 acres of coffee plantation in']"
"Thus, the coffee plantation was successful in areas such as Dumbara valley, Gampola, Peradeniya, Matale, Badulla and many areas of the The amount of coffee export in 1844, was five times bigger than But after 1844 Sri Lanka had to face a huge challenge in the Landon",[79],"['Central Province. The amount of coffee export in 1844, was five times bigger than', 'very profitable. Reports say that there were about 500 acres of coffee plantation in']"
market because of the free trade policy of Britain. the global market too affected badly on the coffee plantation of Sri Lanka. of these reasons the demand for coffee decreased and the value of the coffee lands But this situation reached normalcy again after 1850 with the,[79],"['Central Province. The amount of coffee export in 1844, was five times bigger than']"
reduction of production cost through efficient estate management and the high The major reason for the downfall of coffee plantation in Sri Lanka was the leaf disease that spread since 1869. called “Hemileia Vastatrix” spread fast destroying the coffee plantation.,[79],"['Central Province. The amount of coffee export in 1844, was five times bigger than', 'called “Hemileia Vastatrix” spread fast destroying the coffee plantation.', 'in Sri Lanka was the leaf disease that spread since 1869. The fungus which was']"
"When the coffee cultivation began to deteriorate, some planters started growing Yet cinchona became successful in areas with very high Cinchona was a plant that was used in the production of the medicine called quinine and it had a limited demand.",[79],"['called quinine and it had a limited demand. Therefore, it was not successful as an', 'called “Hemileia Vastatrix” spread fast destroying the coffee plantation.', 'cinchona and cocoa. Yet cinchona became successful in areas with very high']"
"Therefore, it was not successful as an alternative to the coffee plantation. When the coffee plantation began to deteriorate, the government encouraged Anyway, the planters had to bear an additional expenditure",[79],"['called quinine and it had a limited demand. Therefore, it was not successful as an']"
because cocoa needed shade in order to grow well. cocoa had become a successful plantation. It was not spread more than 1200 acres. It was successful only in Matale district.,[79],"['It was successful only in Matale district. Cocoa too failed to provide an alternative', 'called quinine and it had a limited demand. Therefore, it was not successful as an', 'cocoa had become a successful plantation. It was not spread more than 1200 acres.']"
Cocoa too failed to provide an alternative Other crops were tried in the upcountry areas because of the fluctuation of coffee Several such experiments were made on tea plantation The Planters' Association sent a group of estate workers to Assam to study,"[79, 80]",['It was successful only in Matale district. Cocoa too failed to provide an alternative']
"further about tea plantation in 1867. At the same time, James Tailor too experimented growing tea in several areas of Lulkandura estate. Tea plantation spread to about",[80],['It was successful only in Matale district. Cocoa too failed to provide an alternative']
500 acres by 1875 as a result of the above mentioned experiments. began to expand quickly because many planters took to tea plantation due to the destruction of coffee cultivation. By 1894 the amount of tea planted area had reached,[80],['500 acres by 1875 as a result of the above mentioned experiments. Tea plantation']
"Tea plantation spread to the Central, Uva and Sabaragamuwa provinces because it could be grown in any area with more than 60 feet of altitude except in the dry zone of the country. Later it was spread to the Southern and",[80],['500 acres by 1875 as a result of the above mentioned experiments. Tea plantation']
"It is reported that there had been 1200 acres of tea in average size and bigger tea estates in the country by 1930. With this expansion of tea plantation, tea became one of the major export products Though the income from tea went down in certain situations due to",[80],"['500 acres by 1875 as a result of the above mentioned experiments. Tea plantation', 'in our country. Though the income from tea went down in certain situations due to']"
"the excessive tea product after the World War I and the world economic demise in 1929, later it reached to normalcy. Factors that helped the development of the tea plantation: • High demand in the world market for Sri Lankan tea",[80],"['1929, later it reached to normalcy.', 'in our country. Though the income from tea went down in certain situations due to']"
• Conducive environment for tea in many parts of the country except in the dry • Ability to produce good quality tea with the help of modern factories and • Development of transport with the development of roads • Cheap labour received from south Indian labourers,[80],"['1929, later it reached to normalcy.', 'machines', 'zone']"
Coconut is a home crop that existed coconut plantation by 1850 due to characteristic was the enthusiasm foreigners in the coconut plantation.,[82],"['Coconut is a home crop that existed', 'characteristic was the enthusiasm', 'coconut plantation by 1850 due to', 'shown by the natives than the']"
"By 1880, 65% of coconut estate Coconut plantation expanded more in broad flat lands than in the hill country. Areas like Kurunegala, Chilaw and Gampaha were prominent among them. 1920, 27% of the foreign earnings came from coconut products.",[82],"['1920, 27% of the foreign earnings came from coconut products. A coconut research', 'Coconut plantation expanded more in broad flat lands than in the hill country.', 'shown by the natives than the']"
"institution was established in Lunuwila to develop coconut plantation when the coconut plantation started to expand. It is clear that coconut plantation did not aim at export like the other cultivations, owing to the fact that half of the production",[82],"['coconut plantation started to expand. It is clear that coconut plantation did not aim', 'institution was established in Lunuwila to develop coconut plantation when the']"
"was utilized for local consumption. Just as roads and railways developed in the hill country due to tea and coffee plantation, roads in the other parts of the country were developed to support the coconut plantation.",[82],"['coconut plantation started to expand. It is clear that coconut plantation did not aim', 'country due to tea and coffee plantation, roads in the other parts of the country']"
"Though rubber was introduced to Sri Lanka around 1877, it did not show quick expansion because many cultivators during this period were more focused on By the beginning of the 20th century,",[82],"['1877, it did not show quick expansion because many', 'Though rubber was introduced to Sri Lanka around', 'cultivators during this period were more focused on']"
"rubber plantation expanded because rubber price increased due to the expansion of the motor vehicle indutry, suitable rubber species were found for Sri Lanka together with the development of production",[82],"['Lanka together with the development of production', 'increased due to the expansion of the motor vehicle', 'indutry, suitable rubber species were found for Sri', 'rubber plantation expanded because rubber price']"
"techniques and temporary fall of tea prices. plantation which was limited to Kalutara district at the beginning later expanded to the Western, Sabaragamuwa, Southern provinces and some",[82],"['Lanka together with the development of production', 'plantation which was limited to Kalutara district']"
parts of the Central Province. export income was received from rubber products. Later a rubber research institution was started in Agalawatta to develop the rubber Answer the following questions.,"[82, 84]","['Later a rubber research institution was started in Agalawatta to develop the rubber', 'plantation which was limited to Kalutara district']"
"Write three economic reforms of the Colebrooke Commission. Name four commercial crops introduced by the British to this country. Explain two steps taken to expand plantation in Sri Lanka. Mention two advantages and disadvantages each, resulted in the",[84],"['I. Write three economic reforms of the Colebrooke Commission.', 'II. Name four commercial crops introduced by the British to this country.', 'III. Explain two steps taken to expand plantation in Sri Lanka.', 'IV. Mention two advantages and disadvantages each, resulted in the']"
economy of the country due to plantation. A significant social change that took place in Sri Lanka during the British administration is the deterioration of the aristocrats and the emergence of a,[84],"['5.2 Social Change', 'IV. Mention two advantages and disadvantages each, resulted in the', 'administration is the deterioration of', 'the aristocrats and the emergence of a']"
"had higher economic, social and political status than the rest of the positions in the government by being loyal to the existing administration",[84],"['loyal to the existing administration', 'political status than the rest of the', 'positions in the government by being', 'the aristocrats and the emergence of a']"
and had good income because they A government agent and the Kandyan leaders Answer the following questions. Write three economic reforms of the Colebrooke Commission.,"[84, 85]","['A government agent and the Kandyan leaders', 'I. Write three economic reforms of the Colebrooke Commission.', 'and had good income because they', 'people']"
"Name four commercial crops introduced by the British to this country. Explain two steps taken to expand plantation in Sri Lanka. Mention two advantages and disadvantages each, resulted in the economy of the country due to plantation.",[85],"['II. Name four commercial crops introduced by the British to this country.', 'III. Explain two steps taken to expand plantation in Sri Lanka.', 'IV. Mention two advantages and disadvantages each, resulted in the']"
"A significant social change that took place in Sri Lanka during the British administration is the deterioration of the aristocrats and the emergence of a had higher economic, social and",[85],"['5.2 Social Change', 'administration is the deterioration of', 'the aristocrats and the emergence of a']"
political status than the rest of the positions in the government by being loyal to the existing administration and had good income because they,[85],"['and had good income because they', 'loyal to the existing administration', 'political status than the rest of the', 'positions in the government by being']"
"A government agent and the Kandyan leaders The Colebrooke reforms paved the way to a capitalist economic system in Sri Lanka constructing roads and railways because of the new trends of the economy. opening several new ways of earning money instead of the traditional earning result, a local group of labourers emerged in the city areas in addition to the south Among those methods, working as contractors who supplied facilities to Indian labourers.","[85, 86]","['A government agent and the Kandyan leaders', 'people']"
"the plantation sector, production and distribution of arrack, graphite mining, whole sale and retail sale transportation and coconut plantation were the areas in which They received a meagre salary at the beginning. The number of hours they worked Thus, at the onset of the 20th century, there was a was not set.",[86],"['locals could invest money on. Thus, at the onset of the 20th century, there was a was not set. There were no labour insurance, compensation or other labour welfare', 'people']"
"There were no labour insurance, compensation or other labour welfare local wealthy class that earned money by investing money on the above mentioned activities. As a result, the city labourers started to gather and establish workers’ They spent money to give a good education to their sons and daughters unions in order to win their rights.",[86],"['industries. They spent money to give a good education to their sons and daughters unions in order to win their rights. They started to strike in order to get their status', 'local wealthy class that earned money by investing money on the above mentioned activities. As a result, the city labourers started to gather and establish workers’', 'locals could invest money on. Thus, at the onset of the 20th century, there was a was not set. There were no labour insurance, compensation or other labour welfare']"
"They started to strike in order to get their status locally as well as internationally. New job opportunities such as lawyers, engineers, developed as they could feel a growing unity among them. surveyors, clerks and civil servants had emerged by this time.",[86],"['industries. They spent money to give a good education to their sons and daughters unions in order to win their rights. They started to strike in order to get their status', 'locally as well as internationally. New job opportunities such as lawyers, engineers, developed as they could feel a growing unity among them. Some examples for labour']"
"People could demand strikes that took place at the beginning of the 20th century are the strike of printers, a high recognition and better living conditions by getting these jobs through English strike of the Colombo launderers and the carters’ strike. As a result, it became another open door to enter, the middle class. By the third decade of the 20th century the labourers began to organize themselves in",[86],"['locally as well as internationally. New job opportunities such as lawyers, engineers, developed as they could feel a growing unity among them. Some examples for labour']"
There emerged a group of entrepreneurs that manipulated the new earning ways better ways. Gunasinghe is a leader who tried to organize the urban labour which were opened during the British reign as well as an educated group that got posts community in a better way. He became the most renowned leader of labourers from,[86],"['locally as well as internationally. New job opportunities such as lawyers, engineers, developed as they could feel a growing unity among them. Some examples for labour']"
in the government through English education. They were named as the middle class 1922 to 1935. He pioneered to establish the ‘Ceylon Workers Congress’ marking a because they became prominent among the others because they enjoyed a higher landmark in the history of trade unions in Sri Lanka.,[86],['in the government through English education. They were named as the middle class 1922 to 1935. He pioneered to establish the ‘Ceylon Workers Congress’ marking a']
"With the emergence of this new middle class at the beginning of Samaja Party’ led labour struggles establishing trade unions. the 20th century, the traditional aristocratic group began to fade away. the establishment of trade unions among the estate labourers. The educated group in the new middle class became politically active.",[86],['in the government through English education. They were named as the middle class 1922 to 1935. He pioneered to establish the ‘Ceylon Workers Congress’ marking a']
the political struggles in the 20th century. This group which was named as educated  Changes in the Culture middle class was those who earned recognition through western education. result they became a group of rich city dwellers who followed the western culture.,[86],['in the government through English education. They were named as the middle class 1922 to 1935. He pioneered to establish the ‘Ceylon Workers Congress’ marking a']
The Sri Lankan culture experienced heavy changes during the British reign parallel to the changes in the society. The most significant change was the spreading of western culture in the country.,[86],['in the government through English education. They were named as the middle class 1922 to 1935. He pioneered to establish the ‘Ceylon Workers Congress’ marking a']
The western education and studying of English  Emergence of a Labour Class language began to spread fast in the country after the Colebrooke reforms. the foreigners that prepared the curricula and conducted teaching in missionary Another significant feature of the British reign is the emergence of a labour class schools and state aided schools.,[86],['in the government through English education. They were named as the middle class 1922 to 1935. He pioneered to establish the ‘Ceylon Workers Congress’ marking a']
These schools too paved the way for the spreading because of the economic reforms that were made. In the traditional administration of western culture in the country. Some aspects of the western culture invaded Sri,[86],['in the government through English education. They were named as the middle class 1922 to 1935. He pioneered to establish the ‘Ceylon Workers Congress’ marking a']
"system, labour was taken under the compulsory service system for the common Lanka through the behaviour of those who went to western countries for education. activities of the government, leaving no necessity of working for wages. during the British reign plantation was started in the hill country, labourers were More Europeans were attracted to Sri Lanka during the 19th century because of the Since India too was a colony of Britain by this time, expansion of plantations, development of trade and the improvements of transport",[86],['in the government through English education. They were named as the middle class 1922 to 1935. He pioneered to establish the ‘Ceylon Workers Congress’ marking a']
"bringing labourers from Southern India for a meagre salary was more profitable. and communication that took place in the country. As a result their clubs, holiday Therefore, the estate owners brought labourers from India in thousands.",[86],['in the government through English education. They were named as the middle class 1922 to 1935. He pioneered to establish the ‘Ceylon Workers Congress’ marking a']
"As a result resorts started to mushroom in the country accelerating the spreading of western a labour community started to grow in the hill country. As a result of these western dresses, customs and traditions, greetings, western architecture and their food started to mix into the culture of Sri Lanka.",[86],['in the government through English education. They were named as the middle class 1922 to 1935. He pioneered to establish the ‘Ceylon Workers Congress’ marking a']
