text,pages,sections
"Educational Publications Department ISBN - 978 - 955 - 25 - 0664 - 2 Educational Publications Department 765/2, Waduwegama Road, Malwana.","[1, 2]","['Educational Publications Department', 'ISBN - 978 - 955 - 25 - 0664 - 2']"
"The Educational Publications Department which is entrusted with the responsibility of providing a free textbook to the students by the government fulfills the duty diligently in each year for the student community which exceeds Without limiting to the above mentioned important task, the Educational",[4],"['04 million.', 'Foreword']"
"Publications Department is engaged in producing supplementary reading materials for Advanced Level and other higher examinations. process, valuable books with the contribution of subject experts in different fields are sold at a concessionary price.",[4],['04 million.']
These supplementary reading materials can be an excellent source of knowledge for those who sit for examinations and for the reading public who is interested in reading different academic books. I would like to compliment the subject,[4],"['04 million.', 'in reading different academic books. I would like to compliment the subject']"
experts and the staff of the Educational Publications Department who contributed to produce this book. I would like to extend my thanks to you who justify the following saying by George R. R. Martin – “A person who reads books lives thousand lives before,[4],"['I would like to extend my thanks to you who justify the following saying', 'contributed to produce this book.', 'in reading different academic books. I would like to compliment the subject']"
Those who don’t read have only one life”. Commissioner General of Educational Publications Educational Publications Department The Educational Publications Department which is entrusted with the,"[4, 5]","['Commissioner General of Educational Publications', 'Educational Publications Department', 'Foreword', 'I would like to extend my thanks to you who justify the following saying']"
"responsibility of providing a free textbook to the students by the government fulfills the duty diligently in each year for the student community which exceeds Without limiting to the above mentioned important task, the Educational Publications Department is engaged in producing supplementary reading",[5],"['04 million.', 'Foreword']"
"materials for Advanced Level and other higher examinations. process, valuable books with the contribution of subject experts in different fields are sold at a concessionary price. These supplementary reading materials can be an excellent source of knowledge",[5],['04 million.']
for those who sit for examinations and for the reading public who is interested in reading different academic books. I would like to compliment the subject experts and the staff of the Educational Publications Department who,[5],"['04 million.', 'in reading different academic books. I would like to compliment the subject']"
contributed to produce this book. I would like to extend my thanks to you who justify the following saying by George R. R. Martin – “A person who reads books lives thousand lives before Those who don’t read have only one life”.,[5],"['I would like to extend my thanks to you who justify the following saying', 'contributed to produce this book.']"
Commissioner General of Educational Publications Educational Publications Department Monitoring and Supervision - P.N. Educational Publications Department,"[5, 6]","['26 - 06 - 2020', 'Commissioner General of Educational Publications', 'Educational Publications Department']"
Educational Publications Department Educational Publications Department Educational Publications Department Prof. Padmasiri Kannangara - Department of History,[6],"['1. Prof. Padmasiri Kannangara - Department of History', 'Educational Publications Department']"
University of Sri Jayawardhanapura Dr. Anusha Senadhiraja - Senior Lecturer C. Nishani Dharmapala - Senior Lecturer National Insitute of Education,[6],"['2. Dr. Anusha Senadhiraja - Senior Lecturer', '3. C. Nishani Dharmapala - Senior Lecturer', 'National Insitute of Education', 'University of Sri Jayawardhanapura']"
Dr. Rohitha Disanayaka - Senior Lecturer J.M Sudharmawathi - Senior Lecturer W. A. S. Shiromala Gunawardana - Assistant Lecturer National Institute of Education,[6],"['1. Dr. Rohitha Disanayaka - Senior Lecturer', '2. J.M Sudharmawathi - Senior Lecturer', '3. W. A. S. Shiromala Gunawardana - Assistant Lecturer', 'National Institute of Education']"
Sister Mary Doneta - Retired Deputy Principal U.L.M Baseer - Retired In-Service- Adviser U. L. S Marikkal - In-Service- Adviser Pasdunrata National College of,[7],"['6. Sister Mary Doneta - Retired Deputy Principal', '7. U.L.M Baseer - Retired In-Service- Adviser', '8. U. L. S Marikkal - In-Service- Adviser', 'Pasdunrata National College of']"
Language Editing - W. Indumini Darshika Educational Publications Department Type Setting - Jayani Nisansala Dissanayake Educational Publications Department,[7],"['Educational Publications Department', 'Language Editing - W. Indumini Darshika']"
"Cover Page, Page Layout & - Charani Nishamini Alahakoon Map Designing Educational Publications Department CONTENTS Establishment of British Power in Sri Lanka 19 - 40","[7, 9]","['2. Establishment of British Power in Sri Lanka 19 - 40', 'CCCCCCOOOOOONNNNNNTTTTTTEEEEEENNNNNNTTTTTTSSSSSS', 'Cover Page, Page Layout & - Charani Nishamini Alahakoon', 'Map Designing Educational Publications Department']"
National Renaissance in Sri Lanka 41 - 50 Political Changes in Sri Lanka under the British 51 - 64 Social Changes in Sri Lanka Under the British 65 - 78 Receiving of Independence to Sri Lanka 79 - 105,[9],"['3. National Renaissance in Sri Lanka 41 - 50', '4. Political Changes in Sri Lanka under the British 51 - 64', '5. Social Changes in Sri Lanka Under the British 65 - 78', '6. Receiving of Independence to Sri Lanka 79 - 105']"
Significant Revolutions in the World 106 - 125 World Wars and Conventions 126 - 154 The broad change generated by man in the industrial and technological fields within a period of about six decades by producing goods with the help of machines,"[9, 11]","['7. Significant Revolutions in the World 106 - 125', '8. World Wars and Conventions 126 - 154', 'Introduction']"
instead of manual labour is termed as “the industrial revolution.” 1.1 Beginning and Development of the Industrial Revolution The industrial revolution began towards the latter part of the 18th century in Britain. It was limited to Britain for about another half century.,[11],"['1.1 Beginning and Development of the Industrial Revolution', 'It was limited to Britain for about another half century. Yet, by the 19th century, the', 'instead of manual labour is termed as “the industrial revolution.”']"
"influence of the industrial revolution spread to the other countries in Europe and Trade was the major reason for the emergence of the industrial revolution in Europe. When the situation of Europe in the 18th century is analyzed, it can be seen that France, Portugal and Spain other than Britain engaged themselves in colonization",[11],['influence of the industrial revolution spread to the other countries in Europe and']
"Therefore, it is important to inquire into the reasons why such a revolution began in Britain.  Reasons for the Emergence of the Industrial Revolution in Britain Financial and commercial affairs started developing in Europe since the 16th century",[11],['influence of the industrial revolution spread to the other countries in Europe and']
"and by the 18th century, Britain had surpassed some of the other leading European countries such as Holland, France, Portugal and Spain. who could invest money on industries was created in that country. time, there was a rapid growth in the population of Britain which resulted in a high",[11],"['countries such as Holland, France, Portugal and Spain. As a result a wealthy class', 'influence of the industrial revolution spread to the other countries in Europe and']"
demand for goods and in turn producing goods to meet the increasing demand This led to a development in the industrial sector. was an expansion of the knowledge of science as a result of the Renaissance that took place in Europe in 14th and 15th centuries.,[11],"['countries such as Holland, France, Portugal and Spain. As a result a wealthy class']"
This knowledge was used in producing Minerals such as iron and steel that were necessary in producing machinery too were found in Britain. Not only that Britain easily found things like,"[11, 12]","['countries such as Holland, France, Portugal and Spain. As a result a wealthy class']"
"coal which played a major role in producing energy. Though there was a heavy population in contemporary kingdoms such as France, the development of trade in those countries was limited in comparison to Britain. But, Britain had obstructed the commercial relationships of its colonies with other",[12],['coal which played a major role in producing energy.']
countries in the world by imposing several commercial laws. able to maintain a high demand for their productions in its own colonies because they had no other choice than importing those productions from Britain. those products with high demand in Britain were suitable for the production using,[12],"['countries in the world by imposing several commercial laws. Thus, Britain was']"
"One example is the high demand placed upon British cotton clothes Though there was an increasing demand for British cotton clothes, they did not have the ability to increase the production within a short period with the Because of the high demand that existed for the British",[12],"['countries in the world by imposing several commercial laws. Thus, Britain was']"
"productions, there arose a need in increasing the production in a short period. as a solution to this challenge that there was a rapid development in the industrial There were several changes in the agriculture field too in contemporary Britain. There, the rich landowners combined small pieces of land that belonged to poor",[12],"['countries in the world by imposing several commercial laws. Thus, Britain was']"
"This is termed as the “encroaching movement.” As a result of this, the farmers who lost their land migrated to cities in search of jobs. The extra labour that was generated as a result was able to be used for the industrial Unlike in other countries, in Britain talented individuals had the opportunity to earn",[12],"['countries in the world by imposing several commercial laws. Thus, Britain was']"
"money irrespective of their social status. This free social environment in the attitudes supported the spread of novel ideas and it was conducive for the development of Further, together with the development of the economy, the",[12],"['countries in the world by imposing several commercial laws. Thus, Britain was']"
"emergence of new banks and financial organizations that provided capital for the industries and businesses was seen. The political stability that was prevailing in Britain too helped the industrial The parliament provided the freedom, tax relief and support to engage",[12],"['countries in the world by imposing several commercial laws. Thus, Britain was', 'industries and businesses was seen.']"
"in business activities for the economic development. Compared with the other countries in Europe, Britain had the most conducive environment for the industrial revolution. A number of features such as being a",[12],"['Compared with the other countries in Europe, Britain had the most conducive', 'in business activities for the economic development.']"
"small island, ability to build a web of markets throughout the country, ability to charge high prices for productions and London city being a centre that distributed raw materials, capital and products; helped Britain to surpass other countries in the Rise of the Industrial Revolution","[12, 13]","['1.2. Rise of the Industrial Revolution', 'Compared with the other countries in Europe, Britain had the most conducive', 'charge high prices for productions and London city being a centre that distributed']"
"The industrial revolution in Britain was based on three industries as given below. The development that occurred in these fields resulted in the gradual progress in other fields such as transport, communication and agriculture. Textile producers in Britain faced a challenge of increasing their textile products to meet",[13],['1.2. Rise of the Industrial Revolution']
the high demand that came from their own colonies. Weaving clothes became a little faster with the invention of the flying shuttle by John K. in 1733. threads needed in weaving clothes still remained a problem.,[13],['1.2. Rise of the Industrial Revolution']
"According to the situation that was there at that time, threads produced by six thread makers per day were enough only for one weaver to work for",[13],"['1.2. Rise of the Industrial Revolution', 'by six thread makers per day were', 'enough only for one weaver to work for']"
"Therefore, there was some idea of increasing the pace of spinning. result of that enthusiasm, a person called James Hargreaves produced a machine",[13],"['James Hargreaves produced a machine', 'enough only for one weaver to work for']"
"called ‘Jenny’ in 1764 for cotton weaving. This machine was a manually operated Later in 1769, Richard Arkwright produced a more efficient, water powered",[13],"['This machine was a manually operated', 'called ‘Jenny’ in 1764 for cotton weaving.']"
Fig 1.1 – The Jenny machine produced by James turbine’. Hargreaves for spinning cotton in 1764 important production when compared to the other machines used for the same,[13],"['This machine was a manually operated', 'important production when compared', 'to the other machines used for the same']"
"But it was difficult to be used in houses because it was very big in size. On the other hand, because a fast tide of water was needed to run the machine, it could be used only in such places where there was a continuous supply of water. Samuel Crompton who used the steel.","[13, 14]",['to the other machines used for the same']
Steel could be produced cheaply and functioning principles of Spinning quickly in this method. Jenny and the Water Turbine oven to smelt ore by Wilhelm Siemens in produced a new machine called 1870 helped the improvement of iron and,[14],['to the other machines used for the same']
"to produce finer and stronger the way for a rapid improvement in iron Then around 1785, Edmund and steel industry. Cartwright found a way of running within a period of about 30 years",[14],"['Cartwright found a way of running', 'to the other machines used for the same']"
"new machines and novel technical spinning cotton more efficient. Fig 1.2 –The water powered spinning machine Hence, there was a big revolution in Fig 1.3 Henri Bessemer’s oven for producing steel",[14],"['methods were invented to make', 'new machines and novel technical']"
produced by Richard Arkwright the weaving industry during a short Prepare short questions from the section about iron and steel. Make short questions regarding the section on textile industry. Explain the industrial development that took place in iron and steel industry,[14],"['1. Make short questions regarding the section on textile industry. 2. Explain the industrial development that took place in iron and steel industry', '1. Prepare short questions from the section about iron and steel.', 'methods were invented to make']"
Explain the industrial development in textile sector under the following under the following areas. - Reasons for the industrial development in iron and steel industry - Reasons for industrialization in textile sector - New inventions in the above field and their advantages - New productions of textile sector and their advantages,[14],['2. Explain the industrial development in textile sector under the following under the following areas.']
"Ore deposits are found in abundance in Britain. British people produced iron and There are so many coal mines in Britain. South Wales, Yorkshire, Lancashire are steel even before the industrial revolution to make weapons, agricultural equipment some places where coal mines are situated.",[14],['2. Explain the industrial development in textile sector under the following under the following areas.']
"Coal was popular as a cheap and efficient They used firewood to smelt ore for this purpose. It was difficult fuel for smelting ore, running machines and household chores. to meet the huge demand for iron and steel needed for the production of machinery for coal increased with the industrial development, mining coal was difficult.",[14],['2. Explain the industrial development in textile sector under the following under the following areas.']
"that emerged as a result of the industrial revolution using firewood. Several new inventions were made in order to find solutions to the problems such as removing the water that gathered in the mine when it was dug deep, poisonous Hence, alternative methods had to be looked for.",[14],['2. Explain the industrial development in textile sector under the following under the following areas.']
"In 1730 the method of smelting gases found in the depth, increasing heat and providing light to the depth. ore using coal was found by Abraham Darby. They produced molded iron in this In 1784 tempered iron could be produced with the invention of 'Roller' Thomas Newcomen invented a steam engine in 1735 to pump water of the mines",[14],['2. Explain the industrial development in textile sector under the following under the following areas.']
"Henri Bessemer found a new method to produce steel by and artificially cool the air. Yet, it was inefficient and could not be used in other removing dirt from iron in 1856. The invention of open oven method in 1860, by industries too.",[14],['2. Explain the industrial development in textile sector under the following under the following areas.']
"Therefore, James Watt developed this to a new steam engine in 1736. developing the above mentioned method, enabled the production of high quality It was an efficient engine that could be used in many industries. Steel could be produced cheaply and oven to smelt ore by Wilhelm Siemens in","[14, 15]","['2. Explain the industrial development in textile sector under the following under the following areas.', 'oven to smelt ore by Wilhelm Siemens in']"
1870 helped the improvement of iron and the way for a rapid improvement in iron Fig 1.3 Henri Bessemer’s oven for producing steel Prepare short questions from the section about iron and steel.,[15],"['1. Prepare short questions from the section about iron and steel.', '1870 helped the improvement of iron and', 'the way for a rapid improvement in iron']"
Explain the industrial development that took place in iron and steel industry - Reasons for the industrial development in iron and steel industry - New inventions in the above field and their advantages There are so many coal mines in Britain.,[15],['2. Explain the industrial development that took place in iron and steel industry']
"South Wales, Yorkshire, Lancashire are some places where coal mines are situated. Coal was popular as a cheap and efficient fuel for smelting ore, running machines and household chores.",[15],['2. Explain the industrial development that took place in iron and steel industry']
"for coal increased with the industrial development, mining coal was difficult. Several new inventions were made in order to find solutions to the problems such as removing the water that gathered in the mine when it was dug deep, poisonous gases found in the depth, increasing heat and providing light to the depth.",[15],['2. Explain the industrial development that took place in iron and steel industry']
"Thomas Newcomen invented a steam engine in 1735 to pump water of the mines and artificially cool the air. Yet, it was inefficient and could not be used in other Therefore, James Watt developed this to a new steam engine in 1736.",[15],"['2. Explain the industrial development that took place in iron and steel industry', 'industries too. Therefore, James Watt developed this to a new steam engine in 1736.']"
It was an efficient engine that could be used in many industries. Fig 1.4 - A picture of the steam engine Fig 1.5 – Steam engine produced made by Thomas Newcomen by James Watt The problem of providing light to the mines too was solved when Humphry Davy,"[15, 16]","['It was an efficient engine that could be used in many industries.', 'Pump', 'made by Thomas Newcomen by James Watt']"
"produced the safety lamp in 1812. In 1839, a method was found to take coal out of the mines using iron cables instead of the old method of taking them out by women and children using copper cables.",[16],['made by Thomas Newcomen by James Watt']
The development of the coal industry resulted in several by products. by burning coal was used in road construction. Paints that were necessary in dyeing clothes too were made with the help of coal.,[16],"['clothes too were made with the help of coal. It was further used to produce medicine,', 'made by Thomas Newcomen by James Watt']"
"It was further used to produce medicine, perfumes, oil and fertilizers. Explain the development of the coal industry under the 1.Reasons for the industrial development in the coal","[16, 17]","['1.Reasons for the industrial development in the coal', 'and children', 'clothes too were made with the help of coal. It was further used to produce medicine,']"
"2.Advantages of the new inventions of the coal industry. Fig 1.7 – Safety lamp produced by Expansion of the Industrial Revolution The industrial revolution that took place in the fields of textile, coal and iron",[17],"['2.Advantages of the new inventions of the coal industry.', 'Expansion of the Industrial Revolution']"
"industries in Britain soon spread into the other fields also. expansion is considered, two types of expansions can be identified as expansion of industrial revolution to other fields and expansion of industrial revolution to other The new knowledge that emerged in relation to industrial and technological fields as",[17],"['1. Expansion to other fields', 'industrial revolution to other fields and expansion of industrial revolution to other', 'industries in Britain soon spread into the other fields also. When the nature of this']"
"a result of industrial revolution did not limit itself to industries and productions. spread to the other fields too. Fields like transport, communication and agriculture too had rapid development under the influence of the industrial revolution.",[17],['1. Expansion to other fields']
"Many changes took place in the transport sector because of the influence of the With the development of the industrial sector, a necessity of developing a road system arose for transporting raw materials to factories and transporting products to markets.",[17],"['1. Expansion to other fields', 'industrial revolution. With the development of the industrial sector, a necessity']"
"Therefore in 1811, John McAdam introduced a It is called “the Macadam Method.” Macadam Method Macadam method means spreading smal pieces of granite on a strong foundation","[17, 18]","['MMMaaacccaaadddaaammm MMMeeettthhhoooddd', 'industrial revolution. With the development of the industrial sector, a necessity']"
"of biger stones and soil and making roads by pounding and leveling them. Even the vehicles that carry heavy loads of goods and passengers could be driven fast and easily on these roads. Therefore, hundreds of miles of such roads were built",[18],['MMMaaacccaaadddaaammm MMMeeettthhhoooddd']
in Britain and Scotland within a short period. Machines and engines used for transport too developed with the development of The production of the steam engine by George Stephenson in 1814 became a landmark in the industrial revolution.,[18],"['in Britain and Scotland within a short period.', 'landmark in the industrial revolution. As a result, trains could be used to transport']"
"As a result, trains could be used to transport The time spent for transport could be minimized by transporting products from factories to markets and transportation cost was reduced by being able to transport heavy loads of goods at a time.",[18],"['coal and other products. The time spent for transport could be minimized by', 'landmark in the industrial revolution. As a result, trains could be used to transport']"
George Stephenson who invented the locomotive engine was not able to read and write till he was 17 years old. Fig 1.9 The steam engine invented by George Fig 1.8 George Stephenson Stephenson,[18],['coal and other products. The time spent for transport could be minimized by']
"The development that took place in land transport as a result of the industrial revolution, affected the naval and water transport too. In 1807, an American called Robert Fulton produced the steamboat. produced the steam ship in 1811 for passenger transport.","[18, 19]","['In 1807, an American called Robert Fulton produced the steamboat. Henry Bell', 'coal and other products. The time spent for transport could be minimized by']"
"The production of motor car in 1885 by the German, Daimler and the production of the aeroplane by Wright brothers in 1903, made a huge change in the transport system. Thus, as a result of the expansion of the",[19],"['In 1807, an American called Robert Fulton produced the steamboat. Henry Bell']"
