text,pages,sections
king’s luxurious life style can be understood when Versailles palace This distancing between the king made the people's frustration grow into a Fig 7.9 – Queen Marie Antoinette Mary Antoinette was a very proud,[124],"['Mary Antoinette was a very proud', 'The Versailles palace where the king lived was a']"
"She had interfered in the kings Fig 7.4 – Versailles palace Fig 7.5 – Garden of the palace ruling, exploiting his excessive power Fig 7.6 – Inside the palace Fig 7.7 – A bedroom in the palace The relationship between the king and the people was distanced because the king","[124, 125]",['Mary Antoinette was a very proud']
lived in an enclosed luxurious palace leading a separate life. Only the priests and aristocrats could enter the palace. The king got news about the country from the aristocrats. distorted picture about the country.,[125],['lived in an enclosed luxurious palace leading a separate life. The general public were']
Fig 7.8 – Front gate of the of This distancing between the king made the people's frustration grow into a Fig 7.9 – Queen Marie Antoinette Mary Antoinette was a very proud,[125],"['Mary Antoinette was a very proud', 'Versailles palace', 'lived in an enclosed luxurious palace leading a separate life. The general public were']"
"She had interfered in the kings ruling, exploiting his excessive power The French monarchy consisted of an advisory board headed by the king and a bench of ministers that functioned under the above mentioned advisory board.","[125, 126]",['Mary Antoinette was a very proud']
"monarchy was highly corrupted. The local administration that was in the hands of the aristocrats was extremely inefficient. Therefore, the government appointed a",[126],['Mary Antoinette was a very proud']
group of officers called “intendant” for local administration. the aristocrats and new officers made people suffer because the congruence of the People did not have a chance of complaining about their problems or protesting against the monarchy however much they had to suffer.,[126],['Mary Antoinette was a very proud']
There was a board consisting of people’s representatives which was called “States General Council” where the problems of the general public were discussed. it was not summoned for 175 years. Therefore the corrupted and inefficient,[126],"['Mary Antoinette was a very proud', 'it was not summoned for 175 years. Therefore the corrupted and inefficient']"
administration that existed in France monarchy led to a revolution in France.  Social Aspect of the French Revolution By the time the revolution began there existed a feudal society in France. system was a monarchy that was run with the help of aristocrats who had captured,[126],['it was not summoned for 175 years. Therefore the corrupted and inefficient']
"There were three social strata as priests, aristocrats and general public other than the royal family by the time of the revolution. Priests and aristocrats enjoyed all Among the general public there were three groups as middle",[126],['land in masses.']
Aristocrats and the priests were the minority whereas general public was the majority. The middle class was a group that had earned money by trade and other business transactions.,[126],"['class, farmers and labourers. Aristocrats and the priests were the minority whereas']"
"Yet, they did not have any political In countries like Britain, the middle class had got political power but in France, the middle class was disheartened because of the authoritarian power of the aristocrats. Priests were exempted from taxes and they lived on the tax money of the general",[126],"['In countries like Britain, the middle class had got political power but in France, the', 'class, farmers and labourers. Aristocrats and the priests were the minority whereas']"
"Most of the lands in France were owned by aristocrats. Some of the privileges enjoyed by them were;  permission to fish and hunt in any place of the country.  farmers were to go to the grinding mills, wine presses, bakeries owned by",[126],"['In countries like Britain, the middle class had got political power but in France, the']"
aristocrats for their requirements and they had to pay very high charges.  the aristocrats could collect tax from the lands of farmers.  they were exempted from government taxes. It was the middle class that was educated and rich in the French society.,[127],"['In countries like Britain, the middle class had got political power but in France, the', 'It was the middle class that was educated and rich in the French society. Yet they']"
"did not have proper recognition for their status. Though they were educated, all government posts were given to uneducated, inefficient aristocrats. situation, there emerged a concept that one’s standard should be measured based",[127],['It was the middle class that was educated and rich in the French society. Yet they']
on their ability and wealth not on their birth. This provided the background for the emergence of the concept of equality and it later laid the foundation for the Among the under privileged in France the most suffered groups were farmers.,[127],['It was the middle class that was educated and rich in the French society. Yet they']
"represented 92% of the French population. They though owned some land and worked very hard, had to pay taxes to inefficient aristocrats, were suppressed by heavy taxes and cost of living.",[127],['It was the middle class that was educated and rich in the French society. Yet they']
" Economic Conditions that led to the French Revolution By the time of the revolution, the French treasury was completely bankrupt. the excessive expenditure for the luxurious lives of the king and his family unnecessary expenditure for war",[127],['It was the middle class that was educated and rich in the French society. Yet they']
France had to bear losses because of the seven year war with Britain and supporting the American freedom struggle. The heavy taxes were another reason for the French revolution. of France had to pay about 60% of their income as tax.,[127],['It was the middle class that was educated and rich in the French society. Yet they']
"taxes that made people suffer. Taille, Gabelle and Capitation are three examples for  Taille – A levy charged on houses and lands of the general public. Cities like Lion and Paris were free of this tax.",[127],['It was the middle class that was educated and rich in the French society. Yet they']
" Gabelle - This was charged on salt. Every adult had to buy seven pounds of Voltaire explained the importance of expressing one’s own ideas freely. The price of salt differed from area to area. Because of that, salt criticized the monarchy and the monopoly of the church.",[128],['It was the middle class that was educated and rich in the French society. Yet they']
"was transported illegally from areas where salt was cheap to areas where salt Rousseau presented the concept people's sovereignty The transportation of salt was a government monopoly and through his book called ""The Social Contract"".",[128],['It was the middle class that was educated and rich in the French society. Yet they']
"thousands of people who transported salt illegally were imprisoned. exclaimed that the king must work for the betterment of people; if otherwise, the people have the rights to chase  Capitation – This was introduced in 1695 as a levy charged from everybody.",[128],['It was the middle class that was educated and rich in the French society. Yet they']
"His ideas became the foundation of But when in function, the cost had to be completely borne by the general equality and people’s sovereignty. On the other hand, the French soldiers who went to",[128],['It was the middle class that was educated and rich in the French society. Yet they']
"Because of the area based administration system in France, laws and taxes were support the American freedom struggle had identified This situation became an obstacle to local and foreign concept of freedom there and started to activate it in",[128],"['It was the middle class that was educated and rich in the French society. Yet they', 'concept of freedom there and started to activate it in']"
"trade and economic development of France. The middle class people who were France encouraging the French revolution. engaged in trade had to pay high taxes due to these taxes, laws and regulations.",[128],['concept of freedom there and started to activate it in']
reported that a water vessel that carried wine from southern France to Paris had to Fig 7.11 Rousseau pay taxes at 40 places and for that purpose they had to spend additional two weeks There was no security for the money invested by middle class people because the state treasury was bankrupt.,[128],"['class people because the state treasury was bankrupt. This was an obstacle for the', 'concept of freedom there and started to activate it in', 'in addition to the cost. There was no security for the money invested by middle']"
development of the middle class. The middle class expected an economic system By 1789 the closest reason for the French revolution is the situation arose due to the free from government interference.,[128],['class people because the state treasury was bankrupt. This was an obstacle for the']
But the French monarchy failed to provide the financial problems in France where there had been continuous protests. efficient administration on economic security expected by the middle class. in taxes was necessary to settle that situation.,[128],"['class people because the state treasury was bankrupt. This was an obstacle for the', 'in taxes was necessary to settle that situation. The king had to summon the council']"
"The king had to summon the council were the reasons for the middle class to lead the revolution. called, States General Council. There were problems on the agenda of the meeting",[128],"['called, States General Council. There were problems on the agenda of the meeting', 'in taxes was necessary to settle that situation. The king had to summon the council']"
"because the bureau had not met for 175 years. The representatives of aristocrats, priests and general public were there in the council.  Philosophical Ideas that helped the Revolution",[128],"['called, States General Council. There were problems on the agenda of the meeting']"
demanded that they and the priests should meet as a noble board. get together with the priests and defeat the proposals of the lower class people. The emerging bitter feelings against the monarchy were king also agreed to this but the lower class people disagreed.,[128],"['called, States General Council. There were problems on the agenda of the meeting']"
"catalyzed by French philosophical ideas. the third class which represented the general public met separately. like Montesquieu, Voltaire and Rousseau expressed ideas that encouraged the revolution.",[128],"['catalyzed by French philosophical ideas. Philosophers', 'like Montesquieu, Voltaire and Rousseau expressed ideas']"
"The third class which called themselves the National Bureau gathered in an indoor tennis court and took oaths not to dismiss until a new constitution has been designed Montesquieu in his book, “The Spirit of Laws” explained for France because the king closed the hall where the aristocrats met due to their",[128],"['like Montesquieu, Voltaire and Rousseau expressed ideas']"
"the harm in allowing one person to exercise the whole This is called the “oath in the tennis court”. power of a nation and stated that such a condition led Therefore, he suggested dividing power",[128],"['influence. This is called the “oath in the tennis court”. The general public of France', 'like Montesquieu, Voltaire and Rousseau expressed ideas']"
"into three institutions as legislature, parliament and judiciary and he further explained that a dictatorship can Voltaire explained the importance of expressing one’s own ideas freely. criticized the monarchy and the monopoly of the church.","[128, 129]","['Voltaire explained the importance of expressing one’s own ideas freely. He severely', 'criticized the monarchy and the monopoly of the church.', 'into three institutions as legislature, parliament and']"
"Rousseau presented the concept people's sovereignty through his book called ""The Social Contract"". exclaimed that the king must work for the betterment of people; if otherwise, the people have the rights to chase",[129],['criticized the monarchy and the monopoly of the church.']
"His ideas became the foundation of equality and people’s sovereignty. On the other hand, the French soldiers who went to support the American freedom struggle had identified",[129],['criticized the monarchy and the monopoly of the church.']
concept of freedom there and started to activate it in France encouraging the French revolution. By 1789 the closest reason for the French revolution is the situation arose due to the financial problems in France where there had been continuous protests.,[129],['concept of freedom there and started to activate it in']
"in taxes was necessary to settle that situation. The king had to summon the council called, States General Council. There were problems on the agenda of the meeting",[129],"['called, States General Council. There were problems on the agenda of the meeting', 'in taxes was necessary to settle that situation. The king had to summon the council']"
"because the bureau had not met for 175 years. The representatives of aristocrats, priests and general public were there in the council. demanded that they and the priests should meet as a noble board.",[129],"['called, States General Council. There were problems on the agenda of the meeting']"
get together with the priests and defeat the proposals of the lower class people. king also agreed to this but the lower class people disagreed. the third class which represented the general public met separately. The third class which called themselves the National Bureau gathered in an indoor,[129],"['called, States General Council. There were problems on the agenda of the meeting']"
tennis court and took oaths not to dismiss until a new constitution has been designed for France because the king closed the hall where the aristocrats met due to their This is called the “oath in the tennis court”. The people of Paris who were fed,"[129, 130]","['The people of Paris who were fed', 'called, States General Council. There were problems on the agenda of the meeting', 'influence. This is called the “oath in the tennis court”. The general public of France']"
up of the monarchy gathered in France attacked the Bastille prison which was considered a symbol of injustic of the French monarchy,[130],"['France attacked the Bastille prison', 'injustic of the French monarchy', 'up of the monarchy gathered in', 'which was considered a symbol of']"
"and released the prisoners on 14th Fig 7.12 – Attack on Bastille prison The rebellion started in France, spread all around the country. As a result the king’s power was lost and both central and local",[130],"['control this situation. As a result the king’s power was lost and both central and local', 'injustic of the French monarchy']"
administration went into the hands of the rebels. calm by establishing a national security force and rebel committees under the leader King Louise XVI and Queen Antoinette were trialed under the rebels and both of them were sentenced to death.,[130],"['called ‘Lafayette’. King Louise XVI and Queen Antoinette were trialed under the', 'calm by establishing a national security force and rebel committees under the leader', 'control this situation. As a result the king’s power was lost and both central and local']"
" Results of the French Revolution There were several changes in the political, economic and social sectors of France Through this revolution in which people rose against a powerful monarchy and unjust social economic system, world was gifted with",[130],['called ‘Lafayette’. King Louise XVI and Queen Antoinette were trialed under the']
numerous experiences and examples.  the interest on fundamental human rights all over the world The french revolutionalists published a human rights convention in 1791. explained that the fundamental human rights are rights that the people are born,[130],['called ‘Lafayette’. King Louise XVI and Queen Antoinette were trialed under the']
with and not something that is given by the rulers. Some concepts mentioned in the  every human being should have equal rights because everybody is born a free  every citizen has a right to be a part of imposing law.,[130],"['called ‘Lafayette’. King Louise XVI and Queen Antoinette were trialed under the', 'convention are;', 'individual.']"
" every citizen should have the right to express their ideas freely and follow The three concepts; freedom, equality and brotherhood which were the main slogans of the French revolution had high regard in the three quotations of the above mentioned human rights convention.","[130, 131]",['individual.']
People who were suppressed around the world by social inequality were blessed with this. the world later legalized the fundamental human rights in their constitution. There were so many changes in France due to the French revolution.,[131],['individual.']
considered as results of the revolution. downfall of the French monarchy relief for French farmers and labourers instability of political states in France,[131],['considered as results of the revolution. Some such changes are;']
"Governments changed in quick succession after the revolution because those who led the revolution had different political views. This situation lasted from 1789 Because of this unstable political situation, Napoleon Bonaparte, an army",[131],"['considered as results of the revolution. Some such changes are;', 'led the revolution had different political views. This situation lasted from 1789']"
"officer captured power in France in 1799. After that, it was a completely new political system that existed in France. Write an essay on “Human rights won by French people”.",[131],['led the revolution had different political views. This situation lasted from 1789']
"Russia was an empire which covered almost one sixth of the world land by the 20th A systematic organization was needed to govern this huge empire. rulers in Russia those days carried out a stern administration with the help of army forces, police and intelligence services.",[131],"['7.3 Russian Revolution', 'century. A systematic organization was needed to govern this huge empire. The']"
"The deism of the Christian church helped Under this condition the rulers of Russia, Tsars worked Majority farmers, and the labour class created as a result of the industrial development were under the hard grip of the church and aristocrats due",[131],"['century. A systematic organization was needed to govern this huge empire. The', 'industrial development were under the hard grip of the church and aristocrats due', 'like dictators. Majority farmers, and the labour class created as a result of the']"
to the feudal social system that existed in Russia. People had to suffer a lot because Russia too took part in World War I. Because of that the theme of the revolution,[131],['industrial development were under the hard grip of the church and aristocrats due']
"Two revolutions occurred under these themes in March Let’s now probe deep into this revolution which developed with As a result, farming was disturbed because there were no experienced farmers. the purpose of creating a society with no class boundaries. The production of necessary items such as food, medicine, manure was disturbed","[131, 132]",['industrial development were under the hard grip of the church and aristocrats due']
"because a majority of the factories were used for armament production. of that, there was a shortage of food in the country and food prices increased a lot.  Reasons for the Revolution People suffered a lot because the price of bread went up. By the 20th century in Russia as well as in France, a corrupted dictating monarchy",[132],['industrial development were under the hard grip of the church and aristocrats due']
Tsars who became the kings of Russia worked according to anointed kingship. They believed that kingship was granted to them by god and led a corrupted ruling system paying attention only to their needs. People were made to suffer by charging The March revolution in 1917 began with a strike in a textile factory.,[132],['industrial development were under the hard grip of the church and aristocrats due']
taxes in order to increase the income of the government. The kings who followed mega strike within three days. All underprivileged groups gathered in this. the anointed kingship paid more attention to religion without trying to solve the protested along roads demanding for bread.,[132],['industrial development were under the hard grip of the church and aristocrats due']
Even the soldiers in Tsar’s government economic and social problems of the people. The king had to give up his throne in March 1917 because he could not control people’s protests.,[132],"['could not control people’s protests. After this, the administration power was taken', 'industrial development were under the hard grip of the church and aristocrats due']"
"After this, the administration power was taken When the economic and social system of Russia was considered, it seemed that by a group of rebels led by a leader called Kerensky. They too did not have solutions there existed an agricultural economic system based on a feudal social system.",[132],"['could not control people’s protests. After this, the administration power was taken']"
"Land to the problems of the country. Farmers who were the general public of the country, farmers had to work like slaves. Aristocrats were the rich and slaves were considered The necessity of the country by that time was land for farmers, peace for soldiers and",[132],"['could not control people’s protests. After this, the administration power was taken']"
"Farmers had to suffer a lot because they had to pay a part food for all. Because of that, the farmers started to engage in subversive activities by of their harvest earned by cultivating the land of aristocrats as tax to the church, setting fire to lands, robbing and destroying the landowners. A labour community had emerged as a result of the rulers of the new government worked in unison with capitalists going against the",[132],"['could not control people’s protests. After this, the administration power was taken']"
"industrialization that spread in Russia by the 19th century. Anyway, their condition expectations of the underprivileged. Soldiers too became disheartened because the was better than that of farmers.",[132],"['industrialization that spread in Russia by the 19th century. Anyway, their condition expectations of the underprivileged. Soldiers too became disheartened because the']"
But they were a small minority. The middle class was new government too continued the war. also a minority and most of them were government servants. was existing in Russia they lost the war with Japan in 1904 and 1905.,[132],"['industrialization that spread in Russia by the 19th century. Anyway, their condition expectations of the underprivileged. Soldiers too became disheartened because the']"
"It was one of  Revolution in October 1917 the closest reasons to rise a rebellion against the government in 1905. against the government that was started as farmers’ rebellions and labour strikes At the same time, Bolsheviks under the leadership of Lenin worked with the aim of was joined by the rebels of the navy.",[132],"['industrialization that spread in Russia by the 19th century. Anyway, their condition expectations of the underprivileged. Soldiers too became disheartened because the']"
"Though the rebels could not win this fight, it creating a government of farmers and labourers by establishing organizations called became a good omen for a struggle against the government. Soviet Bureaus all over the country. There were two political groups as Bolsheviks",[132],"['industrialization that spread in Russia by the 19th century. Anyway, their condition expectations of the underprivileged. Soldiers too became disheartened because the']"
"and Mensheviks at the beginning of the Russian revolution. Though Tsars made some political reforms understanding that people were rising minority that believed that the problems of people can be solved through minor against the government, people were not satisfied with that and started launching reforms. The majority were the Bolsheviks who believed in communism.",[132],"['industrialization that spread in Russia by the 19th century. Anyway, their condition expectations of the underprivileged. Soldiers too became disheartened because the']"
"There the king ignored the protests and started repressing people. aim was to build a class free society based on communist ideas by breaking down Because of that, the Bolshevik party which was led by Lenin, the leader of rebels the capitalist economic system. This organization which was headed by Lenin and",[132],"['industrialization that spread in Russia by the 19th century. Anyway, their condition expectations of the underprivileged. Soldiers too became disheartened because the']"
